document_id,text_block_text_hash,type,id,text,start_idx,end_idx,sentence,pred_probability,annotator,kb_ids
UNFCCC.party.1880.0,86758b9eed070c2c5f25efa241dcb04d__3166323214131f8e33b9b3677ce2bd91db2a1284bce02c8ebe98c04a06f879e3,CAPACITY-BUILDING,CAPACITY-BUILDING,capacity building,102,119,· Call for increased efforts to improve the coherence and homogeneity of international cooperation in capacity building.,1.0,explorer,
UNFCCC.party.1880.0,2fa22d38ca19d9c2c709a51605cfba88__678bea0c72df96fabd14b75835c1cc96d560411dc7fd7e42541e020121b10f14,CAPACITY-BUILDING,CAPACITY-BUILDING,capacity building,222,239,The level of strategic capacity building of developing countries to respond to,1.0,explorer,
UNFCCC.party.1880.0,2fa22d38ca19d9c2c709a51605cfba88__678bea0c72df96fabd14b75835c1cc96d560411dc7fd7e42541e020121b10f14,CAPACITY-BUILDING,CAPACITY-BUILDING,capacity building,64,81,"· Foster an increased focus on coordinated support for systemic capacity building that integrates efforts related to mitigation, adaptation and prevention, minimizing and addressing loss and damage.",1.0,explorer,
UNFCCC.party.1880.0,7b61b63454fa4cd2c1ed8f1204b50959__75c0fbc6862f1c2f8a4c06c59d4ea803e43723e636df24786ef3e1346b047ac2,CAPACITY-BUILDING,CAPACITY-BUILDING,capacity building,26,43,"· It should be noted that capacity building initiatives that build on the Rio Conventions can also produce mutually beneficial results to advance goals on climate, biodiversity loss, pollution and other environmental and socio-economic development objectives.",1.0,explorer,
UNFCCC.party.1880.0,e98b88c14ce17dc89ac0e9d989ccdc08__eb4189d9d4a3f6e54388698915e8c3723e978e16186510c47bcd7bf82fa71f0b,CAPACITY-BUILDING,CAPACITY-BUILDING,capacity building,295,312,"Strengthening international cooperation in finance, technology and capacity building can enable greater ambition and serve as a catalyst to accelerate mitigation and adaptation, and reorient development pathways towards sustainability.",1.0,explorer,
UNFCCC.party.1880.0,8d9b1915cd66dd0792de43d696cfda73__e5945920186e484690492921fe929176d9d73907d74bdb41721d81d7b870ac87,CAPACITY-BUILDING,CAPACITY-BUILDING,capacity building,106,123,"Canada also recognizes the importance of capacity building and the need for increased support for transparency and monitoring, reporting and verification to establish a credible and effective carbon market and carbon pricing systems. .",1.0,explorer,
