document_id,text_block_text_hash,type,id,text,start_idx,end_idx,sentence,pred_probability,annotator,kb_ids
UNFCCC.non-party.1855.0,a7820285a0ca691e67a498fbc3615466__6002ee69609db3088ffb63ab083d0bc70682ba127c6aa9d5b78fa784afe47d7a,CAPACITY-BUILDING,CAPACITY-BUILDING,capacity building,428,445,"More specifically, LOCAL provides capacity building and technical assistance to local governments to help them better assess climate risks and vulnerabilities and integrate climate change adaptation into their planning and budgeting processes - thus improving preparedness for, awareness of and resilience to climate change.",1.0,explorer,
UNFCCC.non-party.1855.0,961d460986c77ccb0a3b38f1144ccda8__936c17a34d3ab91cc039680894ddb99fcede668028e16040b53f924c476f08f2,CAPACITY-BUILDING,CAPACITY-BUILDING,Capacity-building,205,222,Capacity-building support and learning-by-doing in managing these tools and using them for local adaptation planning are further bridging the capacity gap.,1.0,explorer,
UNFCCC.non-party.1855.0,2a0253d419faae741ebf7bb964b650bb__f0758505b6f7913b1a8473c5f58573bee44a417e46bca1574f5d19f8db357257,CAPACITY-BUILDING,CAPACITY-BUILDING,capacity building,207,224,"The LOCAL Facility combines performance-based climate resilience grants (PBCRGs) that ensure the programming and verification of climate change expenditures at the local level, with technical assistance and capacity building support.",1.0,explorer,
UNFCCC.non-party.1855.0,a84f7e638e774d371faa3dfce30dcd12__6fd954778428ce6141e5ed9792ce6affa05db83022618a85502fc1a5b7593f8f,CAPACITY-BUILDING,CAPACITY-BUILDING,capacity building,523,540,It also enables Parties to implement their NDCs through local climate action and implementation by increasing local investments and related capacity building and technical support in countries through PBCRGs.,1.0,explorer,
UNFCCC.non-party.1855.0,d38105d74a8162dae9ed53561b7ccf70__6b6cbe62b4c26c6d14b79751c414911b32436cc1a687a20f7a8d686554972fbb,CAPACITY-BUILDING,CAPACITY-BUILDING,capacity building,882,899,"ACCAF has five categories to classify local adaptation investments: climate-specific, climate-smart, climate strategic, climate complementary, and awareness and capacity building to inform the adaptation intervention and rationale.",1.0,explorer,
UNFCCC.non-party.1863.0,6fc630fd005b5481a27c9586db6a4a86__43bfc0fea0ffae15cc4e623f079a9af3f2ee3ca67cc3c03890545a0aeada2e68,CAPACITY-BUILDING,CAPACITY-BUILDING,capacity building,367,384,"And by ambition, we mean all aspects necessary to reach all of the Paris goals : mitigation, adaptation, means of implementation and support, finance flows, addressing loss and damage, science, technology transfer and capacity building while securing intergenerational justice, gender equality, and a just transition, protecting human rights, labour rights and biodiversity.",1.0,explorer,
UNFCCC.non-party.1863.0,d82793272338e3a6eaf5d5689a27aee5__e3dbd46b1fe3b5e4e160a60ad7807159b08fdb795ae85e807acf98a6d15fd9b4,CAPACITY-BUILDING,CAPACITY-BUILDING,capacity-building,73,90,"Cross-cutting issues, especially around equity, human rights, finance, capacity-building and education/training",1.0,explorer,
UNFCCC.party.1852.0,2805bdfd7797fb7cc7efab2981641d68__071c59ef9dfc478eeea50342445a2d63f86e7ed36618679f23ba242c1b5c5413,CAPACITY-BUILDING,CAPACITY-BUILDING,capacity building,116,133,"For South Africa, enhanced means of implementation support, in the form of climate finance, technology transfer and capacity building, is a practical and real-world necessity to empower us to achieve our ambitious goals and further enhance our ambition.",1.0,explorer,
UNFCCC.party.1852.0,f85b985e99e1339c0ee1d8512184ab37__0fd10e15b60ebc7ed2c4c6e912cd0a8fdc9546deedcce408a3370ca706986f45,CAPACITY-BUILDING,CAPACITY-BUILDING,capacity-building,64,81,"· Means of implementation and support: finance, technology, and capacity-building",1.0,explorer,
UNFCCC.party.1852.0,3fa4fa9dfeac62b00d92a69a5c76562e__7bb014273f5f50826000bd53d06f2e2024c1f47b00d1b5bdd76914a091637457,CAPACITY-BUILDING,CAPACITY-BUILDING,build capacity,345,359,Continuous support is also required to build capacity for reporting on adaptation and loss and damage in developing country Parties' Biennial Transparency Reports.,1.0,explorer,
UNFCCC.non-party.1857.0,20c109c21709e5c10933ff84c934ba64__6c455eba592e97d0a59f2046d2daf2bf57a352284b35c80bdfed6395d26026bb,CAPACITY-BUILDING,CAPACITY-BUILDING,capacity building,106,123,"Various synthesis reports of the GST's First and Second Technical dialogues have highlighted the need for capacity building - at global, regional and national level - to track, monitor, evaluate and report on progress.3 Monitoring and evaluation systems are needed that combine different sets of evidence, allow for regional aggregation, measure effectiveness, quantify the means of implementation and support, and help answer policy questions, in order to make progress towards the Paris Goals.4",1.0,explorer,
UNFCCC.non-party.1857.0,cbd41e06e55962d7ad397785757a3846__487feef8d4b62dc38316df38119df990f2a1a980dd438eae38e6faa4b49e97c1,CAPACITY-BUILDING,CAPACITY-BUILDING,Capacity-building,29,46,Paris Committee on Capacity-building.,1.0,explorer,
UNFCCC.party.1833.0,794d79c29e81c17078a47dd5654148fd__315b778079a1f8bececb2d3626a7d76cb91e1f18b6536ad96f9c9010075e2e56,CAPACITY-BUILDING,CAPACITY-BUILDING,capacity building,6,23,How capacity building needs based on recommendations and main gaps will be considered or defined?,1.0,explorer,
UNFCCC.party.1833.0,7507bfebd8cf9bdb3a5c5282c5df3e07__8b70e638f3496d3c6a92e283720027e01cb7dcd6ab45dc5a121e6a4836ed0e6d,CAPACITY-BUILDING,CAPACITY-BUILDING,capacity building,226,243,"In this sense, support and capacity building needed for this periodic reporting should be foreseen.",1.0,explorer,
UNFCCC.party.1833.0,18e97d4c504ccddc5297bc82c04592f9__2d3ec4831607da5d6027f0afd8cdf69f1f07c47a980f3b62e5ecdc73b3884193,CAPACITY-BUILDING,CAPACITY-BUILDING,capacity-building,336,353,"It could invite the Adaptation Committee and the LEG to strengthen their work to support the progress towards the Global Goal on Adaptation, and invite the PCCB and NWP to prioritize capacity-building support for GST follow-up.",1.0,explorer,
UNFCCC.non-party.1865.0,549b3e2a659e6243ab6a3824ef52e728__a0850147252613a97e3c90bf25d1cfb7bcfd627fd2a100db47ea5b9905e3e389,CAPACITY-BUILDING,CAPACITY-BUILDING,capacity building,285,302,The GST can support increased international cooperation and capacity building on such topics.,1.0,explorer,
UNFCCC.party.1837.0,f85b985e99e1339c0ee1d8512184ab37__0fd10e15b60ebc7ed2c4c6e912cd0a8fdc9546deedcce408a3370ca706986f45,CAPACITY-BUILDING,CAPACITY-BUILDING,capacity-building,64,81,"· Means of implementation and support: finance, technology, and capacity-building",1.0,explorer,
UNFCCC.party.1837.0,4de224265e9d7a264495c20c4f3aa48c__4874eaab487099b367b9d62fdc468dd58853bd16ab36a1c7e8bcdc3ceae292b9,CAPACITY-BUILDING,CAPACITY-BUILDING,capacity building,150,167,"For the Group of 77 and China, for example, the enhanced means of implementation support, in the form of climate finance, technology transfer and capacity building from developed to developing countries, is a practical and real-world necessity to empower us to achieve our ambitious goals and further enhance our ambition.",1.0,explorer,
UNFCCC.party.1837.0,76cde74c37a8aac396397faa5c685c2a__5e6768eb79ce38b19423dcdeedb27d5b59fe0bfe74d5ef4122a513728e5a9c1e,CAPACITY-BUILDING,CAPACITY-BUILDING,capacity building,232,249,"· Identifying the good practices, lessons learned, opportunities, challenges, needs, and gaps for enhancing implementation andambition , with respect to mitigation, adaptation, the provision of the means of implementation (finance, capacity building and technology transfer) to developing countries, addressing the consequences of response measures, and averting, minimizing, and addressing loss and damage as indicated in para 6(b) of decision 19/CMA.1 in a balanced manner (paragraph 15(iii) of the G77 and China's 25 May 2022 GST Submission).",1.0,explorer,
UNFCCC.party.1844.0,623d34cec4fc10f4214438916257b02a__367e074abdb98b2cf1941beab39fc49829b63f6eddca4e7babedd2bdefb4e9e3,CAPACITY-BUILDING,CAPACITY-BUILDING,capacity building,326,343,"The review results stage should summarize the obstacles hindering the progress of global response to climate change and conduct an in-depth analysis of the reasons, including gaps in early performance, ineffective implementation of commitments, and insufficient financial, technical, and capacity building support.",1.0,explorer,
UNFCCC.party.1839.0,67639a9246c7ed81d7d926fcd7adb548__3978c9b950a04d3d11d725e4ec1177d4cd73ddfce499de581c31dc927bbbf4c2,CAPACITY-BUILDING,CAPACITY-BUILDING,capacity building,405,422,"In addition, it must also provide guidance on capacity building and technology development and transfer, there are critical enablers to achieve the goals of the Paris Agreement.",1.0,explorer,
UNFCCC.party.1835.0,2aeecc4842cc49f4abef7d47d0ad7ef4__7425fa202f9ef09084c063ff51644eb287dd207437126dd2492cc8b8a3c9b014,CAPACITY-BUILDING,CAPACITY-BUILDING,capacity-building,307,324,"The outcome should urge developed countries to provide commensurable finance mostly from grants, remove barriers to access to finance, provide technology transfer and capacity-building support to developing countries, avoiding all forms of procrastination.",1.0,explorer,
UNFCCC.non-party.1862.0,d17f59ff5b680f4d1db9c7acafce7c7c__1097d11b060f9e74b7ef8d046951fba5c2ac8411510df827301bb502b7ddf3cc,CAPACITY-BUILDING,CAPACITY-BUILDING,building capacity,365,382,"Therefore, Impulsouth is supporting country research around climate change, is building capacity through a virtual training course for young climate professionals and is launching a solutions lab to tackle key climate challenges in each of the countries.",1.0,explorer,
UNFCCC.non-party.1862.0,8b03b95b78a2c81282b0df2be56f0599__488f3b826597692fb026cf66c44460643abb7c1c68ee2cfb8fca70f7c7be5ece,CAPACITY-BUILDING,CAPACITY-BUILDING,capacity building,118,135,"In that context, Impulsouth has organized a series of exchanges between global and national stakeholders regarding capacity building for climate action with an emphasis on youth and gender, the lessons of which have been sent through a first submission presented in August 2022, with the intention to inform the Global Stocktake process.",1.0,explorer,
UNFCCC.non-party.1862.0,bbac67675c1195993125c33090c18013__de9f45fc5cb94c366fb91fdd01ee642183e360f2245728a5a1d87273eed910e5,CAPACITY-BUILDING,CAPACITY-BUILDING,capacity building,215,232,"For instance, regardless of article 3 of the Paris Agreement saying that NDCs must include mitigation, adaptation, finance, technology and capacity building, no developed country has included the latter 3, which are an enabler for action globally and for the paradigm shift and transformations needed to crystalize.",1.0,explorer,
UNFCCC.non-party.1862.0,f13f373e914c19360d927e257979e8eb__d604722aedf41fcaa9b836e88e2e13e2a2157cb4f449ddbd1ba2fedc4f9b28a4,CAPACITY-BUILDING,CAPACITY-BUILDING,capacity building,241,258,"i. This component should focus on those issues that at a technical level have found difficulties but are arguably the most important in light of current climate impacts, like monitoring adaptation actions, vulnerability, losses and damages, capacity building efficacy, long term planning, methodologies to assess indicators and monitoring and reporting systems.",1.0,explorer,
UNFCCC.non-party.1854.0,f87e8e761fb1139ffc8b2f2add78dffb__e1c9e018ec45070abce0fb29e8b4222e5589e541b298376d0fcf5a98d8b33f35,CAPACITY-BUILDING,CAPACITY-BUILDING,capacity-building,472,489,"To benefit the most vulnerable children and communities, climate finance needs to be accessible, delivered as grants, and a much greater proportion of it must be dedicated to adaptation action that is focused on increasing the resilience of essential child services including health, WASH, nutrition, education, social protection, and child protection, including capacity-building projects for communities.",1.0,explorer,
UNFCCC.party.1843.0,e1731e41e62f9fce263026faf7d4cc99__e2e8adab1e5d3e82b75e9b57a0bf694b224dcfb4741815c4666c32be67675382,CAPACITY-BUILDING,CAPACITY-BUILDING,capacity-building,62,79,"- Barriers and challenges, including finance, technology, and capacity-building gaps, faced by developing countries;",1.0,explorer,
UNFCCC.party.1879.0,914b612d4d5a327fae3ee9a67ba1f322__c015bc7020813f1c94c0a8957c2335c310a9497f98d89c7d104f78d22a53183f,CAPACITY-BUILDING,CAPACITY-BUILDING,capacity building,134,151,"· An approach to adaptation finance that recognizes the importance of locally led adaptation approaches, including through supporting capacity building for the people and communities on the frontlines of climate change.",1.0,explorer,
UNFCCC.party.1879.0,ef007f97e5a3863e81256823591d82bd__ef8425110ab648d219eb293f9f2a77a0d3623cb801c6ad801c1af6f56494ec0b,CAPACITY-BUILDING,CAPACITY-BUILDING,Capacity building,0,17,Capacity building,1.0,explorer,
UNFCCC.party.1879.0,a74d0ec470dd9c8c929abf15bc599c68__194d167035e59458fdb54137c01621d80e9763008835cda6fc62e4206001b954,CAPACITY-BUILDING,CAPACITY-BUILDING,capacity-building,52,69,"· Parties have made significant efforts to scale up capacity-building support since the adoption of the Paris Agreement, including through the Paris Committee on Capacity building (PCCB).",1.0,explorer,
UNFCCC.party.1879.0,a74d0ec470dd9c8c929abf15bc599c68__194d167035e59458fdb54137c01621d80e9763008835cda6fc62e4206001b954,CAPACITY-BUILDING,CAPACITY-BUILDING,Capacity building,162,179,"· Parties have made significant efforts to scale up capacity-building support since the adoption of the Paris Agreement, including through the Paris Committee on Capacity building (PCCB).",1.0,explorer,
UNFCCC.party.1879.0,d4e731ef5f1cfd58b368fdc56339bb28__a0aa022d93530f0724bb10cb518a64ee3d64557aacd441a4ab8357ec6e9e5193,CAPACITY-BUILDING,CAPACITY-BUILDING,capacity-building,179,196,"· However, while capacity-building is critical for implementation, particularly in Least Developed Countries and Small Island Developing States, there are still gaps in accessing capacity-building and indicators of progress on are difficult to monitor.",1.0,explorer,
UNFCCC.party.1879.0,d4e731ef5f1cfd58b368fdc56339bb28__a0aa022d93530f0724bb10cb518a64ee3d64557aacd441a4ab8357ec6e9e5193,CAPACITY-BUILDING,CAPACITY-BUILDING,capacity-building,17,34,"· However, while capacity-building is critical for implementation, particularly in Least Developed Countries and Small Island Developing States, there are still gaps in accessing capacity-building and indicators of progress on are difficult to monitor.",1.0,explorer,
UNFCCC.party.1879.0,8a42ba05f312c482e089eeeffb23772c__da8b59379e1526772ef74024598287849f19bcb8ffa90311fb8d8b131456d1b0,CAPACITY-BUILDING,CAPACITY-BUILDING,capacity building,36,53,The global response with respect to capacity building could include the following elements:,1.0,explorer,
UNFCCC.party.1879.0,aaa47242b2efbf54cfd15377e17daa3e__1aa995ca68fd87c6d9d7b9011a43397f737033c96069acc10fa99cd38692aba3,CAPACITY-BUILDING,CAPACITY-BUILDING,capacity-building,17,34,· Recognize that capacity-building is foundational to achieving broad-ranging and sustained climate action and requires effective country-led and needs-based cooperation to ensure capacities are enhanced and retained over time at all levels.,1.0,explorer,
UNFCCC.party.1879.0,ca87a64e8a93a787f08b8c8f8f7112f3__d639f594bf422e5dc1292b615e6f0d6fe1d6d316af492f393f12bc21f514b949,CAPACITY-BUILDING,CAPACITY-BUILDING,capacity-building,28,45,· Recognize that successful capacity-building work is inclusive.,1.0,explorer,
UNFCCC.party.1879.0,a94481bc71e14e234fddd85b9f7c8d9b__a892137485ad93c6950607b36aff3cb655e7af556fc5f6824f54b2bcec86dc9f,CAPACITY-BUILDING,CAPACITY-BUILDING,capacity-building,105,122,· Call for strengthened efforts to improve the coherence and consistency of international cooperation on capacity-building.,1.0,explorer,
UNFCCC.party.1879.0,5de18a48b05210e43b6e1400482f5d7b__4ce9506c4d6714b00071f4686d4fbb6c9d3650d8047c474d088e7dc4c392a37e,CAPACITY-BUILDING,CAPACITY-BUILDING,capacity-building,52,69,"· Encourage a greater focus on coordinated systemic capacity-building support that integrates across efforts related to mitigation, adaptation and averting, minimizing, and addressing loss and damage.",1.0,explorer,
UNFCCC.party.1879.0,5de18a48b05210e43b6e1400482f5d7b__4ce9506c4d6714b00071f4686d4fbb6c9d3650d8047c474d088e7dc4c392a37e,CAPACITY-BUILDING,CAPACITY-BUILDING,capacity-building,237,254,The level of the level of strategic capacity-building to developing countries to address locally determined needs must be increased.,1.0,explorer,
UNFCCC.party.1879.0,299814f22df18f086fdb876ad08f366c__cac967aff45cdf8dbc2675aeffaf1e8e0b4ded210dda7c4dc9c918440e11c5d8,CAPACITY-BUILDING,CAPACITY-BUILDING,capacity building,12,29,"· Note that capacity building initiatives bridging the Rio Conventions, may also provide mutually beneficial outcomes to advance climate, biodiversity loss, pollution and other environmental and socio-economic development objectives.",1.0,explorer,
UNFCCC.party.1879.0,0183cb638e45d8fe7163ed119e869821__daaf30e2b0256d1557599c97eb662bea21aa1afa1ef5d357b2e938d2f08c265b,CAPACITY-BUILDING,CAPACITY-BUILDING,built capacity,361,375,"This has, in turn, built capacity, informed policy and incentivized greater climate action.",1.0,explorer,
UNFCCC.party.1879.0,9a761fb71c827fd63670e984f7add3eb__470f242c602299472bbb3556e689bebbcd4d6f39eb55f143f940cf0f73927e2b,CAPACITY-BUILDING,CAPACITY-BUILDING,capacity building,258,275,"Enhancing international cooperation on finance, technology and capacity building can enable greater ambition and can act as a catalyst for accelerating mitigation and adaptation, and shifting development pathways towards sustainability.",1.0,explorer,
UNFCCC.party.1879.0,319c9b89006b351ab52e298f26735e80__35b19622bf6c0da2fc372e340fae09913157f142958afff257f3db9174252a10,CAPACITY-BUILDING,CAPACITY-BUILDING,capacity building,517,534,"Canada also recognizes the importance of capacity building and the need for enhanced support for transparency and monitoring, reporting, and verification in establishing credible and effective carbon market and carbon pricing systems.",1.0,explorer,
UNFCCC.party.1836.0,56d2ec6dbc9c24fcb649ef263f0157f2__6f9d6f7f8d0c353979b888f195a249f1aa54b9e4b3e8f011ddb6a3939f47c5d2,CAPACITY-BUILDING,CAPACITY-BUILDING,build capacity,62,76,o The response measures forum and its KCI have helped Parties build capacity to implement domestic just transition policies.,1.0,explorer,
UNFCCC.party.1836.0,90f12a7f973e4786858878c67496afc8__4a9559d9dd5f3e3fda70f05411e6b35ba02a851e6a653eb426ea03de3bfe779c,CAPACITY-BUILDING,CAPACITY-BUILDING,capacity-building,66,83,Collective progress on the mobilization and provision of support: capacity-building,1.0,explorer,
UNFCCC.party.1836.0,a140a96f4606989b2fdce155771244de__1b44904c58c4f5de6715b0070d67fc98243e6c31b98305a7d156b8d2714a7956,CAPACITY-BUILDING,CAPACITY-BUILDING,Capacity-building,2,19,"· Capacity-building is critical to long-term durable, independent, and rapid climate action and sustainable development.",1.0,explorer,
UNFCCC.party.1836.0,75da6de5a580365abdf1a0b4d556f81b__52c07aa6fde8aaadd7f7959c83969048b2b8009d9ec9db58d5b15e4e8a040fa5,CAPACITY-BUILDING,CAPACITY-BUILDING,capacity-building,13,30,· Successful capacity-building work is inclusive.,1.0,explorer,
UNFCCC.party.1836.0,7f87bb970873392776c9cead513f294b__046a1d9ac9a3a1b635f18bcda97bd78c73f71ecc5a3f5c016d0bc5e70f33adbe,CAPACITY-BUILDING,CAPACITY-BUILDING,capacity-building,13,30,"· Successful capacity-building is locally- and nationally-owned, and ultimately can be maintained and enhanced independent from international support.",1.0,explorer,
UNFCCC.party.1836.0,536607a79b4d646672eebcaebe107477__afb023b165f63f521948c19e72ac56b491d527d9a74537985bcdd61af176e0d8,CAPACITY-BUILDING,CAPACITY-BUILDING,capacity-building,13,30,"· Successful capacity-building has direct finance benefits (e.g., through building capacity for more resource-efficient approaches to climate action, the climate action itself saves costs and is more durable), in addition to creating a positive feedback loop of additional and sustained mitigation and adaptation action.",1.0,explorer,
UNFCCC.party.1836.0,37cc4a4156f9d941bc6a14f5e05a6805__8b39eb7345f5359798d5099b95005d0b04cb7799114fe25486dbc769227e88e1,CAPACITY-BUILDING,CAPACITY-BUILDING,capacity-building,119,136,The Paris Committee on Capacity-building (PCCB) has taken a number of steps to enhance coherence and coordination of capacity-building under the Paris Agreement.,1.0,explorer,
UNFCCC.party.1836.0,37cc4a4156f9d941bc6a14f5e05a6805__8b39eb7345f5359798d5099b95005d0b04cb7799114fe25486dbc769227e88e1,CAPACITY-BUILDING,CAPACITY-BUILDING,Capacity-building,25,42,The Paris Committee on Capacity-building (PCCB) has taken a number of steps to enhance coherence and coordination of capacity-building under the Paris Agreement.,1.0,explorer,
UNFCCC.non-party.1864.0,ff9362f965a81da57bea4d5ca816effb__5fa7a2254fa8cf34cdf4883375ac7ebea46c1dbf107f6761858973f9be66048b,CAPACITY-BUILDING,CAPACITY-BUILDING,capacity building,231,248,"The GST must raise the ambition of Parties across all pillars of the Paris Agreement, including across mitigation, adaptation, means of implementation and support, finance flows, loss and damage, science, technology transfer and capacity building, ecosystem conservation and restoration, equity, just transition, gender equality and human rights.",1.0,explorer,
UNFCCC.party.1845.0,a2c52841463b95e09f4a341203eb5e94__a997079ebc0b6d5626180ad45c247c3fa52a00c5accabad66b9fae6adb946f19,CAPACITY-BUILDING,CAPACITY-BUILDING,capacity-building,355,372,"The consideration should summarize the obstacles that hinder the global response to climate change and analyze the reasons in depth, including gaps in delivery of pre2020 commitments, inadequate implementation of pledges, and insufficient financial, technology development and transfer, and capacity-building support.",1.0,explorer,
UNFCCC.party.1834.0,5488f98f3b3dfbf9f4d23a4d0352ceae__3c912fd6fc80e50bb2aea56bd6f09a1e2ffb9c7808a5cb5ba0e53fe273e2c61c,CAPACITY-BUILDING,CAPACITY-BUILDING,capacity building,306,323,"But support will also be needed after to build local capacities to accelerate the implementation of the guidance, including by capacity building programs, developing comprehensive and continuous education, public awareness, and engagement with a wide array of civil society actors.",1.0,explorer,
UNFCCC.party.1880.0,fb6b1c48a73af1da3e7ef2ba687da816__2208d40e630dd7fd177091a22f3f0b9bd3841dc824f9c5a3b1dbb3b5c8853d1e,CAPACITY-BUILDING,CAPACITY-BUILDING,capacity building,139,156,"· An approach to adaptation financing that takes into account the importance of locally driven adaptation approaches, including supporting capacity building for people and communities on the front lines of climate change.",1.0,explorer,
UNFCCC.party.1880.0,4ba5f1c44a35da7ef319774a9e6d30e9__bf4d33733e2a75473ac4afe0abbf8ce9eca1b0f086e06cf213de7e8417165be8,CAPACITY-BUILDING,CAPACITY-BUILDING,Capacity Building,0,17,Capacity Building,1.0,explorer,
UNFCCC.party.1880.0,00e79cdeac9c738cb583e92f0985828e__72577859c3f96eba6ed8f40afd22bae3fc0fb3f29a8cde9304a8c114eb891f7e,CAPACITY-BUILDING,CAPACITY-BUILDING,capacity building,109,126,"· Since the adoption of the Paris Agreement, Parties have made significant efforts to strengthen support for capacity building, including through the Paris Committee on Capacity Building (CPRC).",1.0,explorer,
UNFCCC.party.1880.0,00e79cdeac9c738cb583e92f0985828e__72577859c3f96eba6ed8f40afd22bae3fc0fb3f29a8cde9304a8c114eb891f7e,CAPACITY-BUILDING,CAPACITY-BUILDING,Capacity Building,169,186,"· Since the adoption of the Paris Agreement, Parties have made significant efforts to strengthen support for capacity building, including through the Paris Committee on Capacity Building (CPRC).",1.0,explorer,
UNFCCC.party.1880.0,43eb73466b872e89d73380eabeab5e55__4fa06b4b3b3d6adbf6fc562928ba9694ec01bcf175525aff9fd98483e50d41e3,CAPACITY-BUILDING,CAPACITY-BUILDING,capacity building,17,34,"· However, while capacity building is essential for implementation, particularly in least developed countries and small island developing States, there are still gaps in access to capacity building, and indicators of progress is difficult to monitor.",1.0,explorer,
UNFCCC.party.1880.0,43eb73466b872e89d73380eabeab5e55__4fa06b4b3b3d6adbf6fc562928ba9694ec01bcf175525aff9fd98483e50d41e3,CAPACITY-BUILDING,CAPACITY-BUILDING,capacity building,180,197,"· However, while capacity building is essential for implementation, particularly in least developed countries and small island developing States, there are still gaps in access to capacity building, and indicators of progress is difficult to monitor.",1.0,explorer,
UNFCCC.party.1880.0,ff81b3195b145a30dd9027aa80c27671__1c371d2137f28c1568f4db308fb85c825fee08e5c97896a3cad73e1e719fe844,CAPACITY-BUILDING,CAPACITY-BUILDING,capacity building,11,28,The global capacity building response could include the following:,1.0,explorer,
UNFCCC.party.1880.0,2f2d1ed16a1e836066eebe89c85636c7__e6ce17842c360dae42b6cc82155b13fb79e9d114eb19edff4907ee157efa0bea,CAPACITY-BUILDING,CAPACITY-BUILDING,capacity building,17,34,"· Recognize that capacity building is essential to implementing large-scale, sustainable climate action, and requires effective, country-led, needs-based cooperation to ensure that capacity are strengthened and maintained over time at all levels.",1.0,explorer,
UNFCCC.party.1880.0,fc6f88c958c58ffc2f28593252ddf940__509feca8ad588b4571c0af2ce27f2bb970832ecd7a4940bb34fed11119127e14,CAPACITY-BUILDING,CAPACITY-BUILDING,capacity building,28,45,· Recognize that successful capacity building work is inclusive.,1.0,explorer,
