document_id,text_block_text_hash,type,id,text,start_idx,end_idx,sentence,pred_probability,annotator
CCLW.GST.494.494,f664880a8888d641ff5481ff6508d47b__04c50da96883a94fe42e106fa1c3879d71678b5adfd16a83d6b193fa730c4880,INTERNATIONAL_COOPERATION,,International Cooperation,15,40,Enterprise for International Cooperation),1.0,explorer
CCLW.GST.494.494,a059389279b597d1fc25d9d5ab06cbfb__c8565cd7650c9970d3b521c8ba83a57c6935f625de96006fead1535a8c95ab57,INTERNATIONAL_COOPERATION,,International co-operation,0,26,"International co-operation through both multilateral and bilateral, and",1.0,explorer
CCLW.GST.494.494,717597044786dfb379edb027135a661e__9b90b69d77aa34d16b31664b4e94be393c33ca6a75f43060d96d0e5076e93633,INTERNATIONAL_COOPERATION,,international cooperation,0,25,"international cooperation and new policy instruments, forest resources are expected",1.0,explorer
CCLW.GST.595.595,0bc2ba4c43f2d387a90582a419b736d0__5d180995d461e0fee7398d1850031f98459c844781314477691ed6c54f3d6001,INTERNATIONAL_COOPERATION,,international cooperation,313,338,"According to the legislation, support from GEFS can be used for reduction of GHG gases, for the creation of GHG sinks, or for measures aimed to reduce the effects of climate change in case of international cooperation.",1.0,explorer
CCLW.GST.595.595,1c2a4cf0c1671bb82fe8a63ba3847bc8__b7f892f48480427de49f5ca507053223351fc6ca7cf207b55aad28fa922965bb,INTERNATIONAL_COOPERATION,,international cooperation,281,306,"Comprehensive integration of a water management that is aligned to climate change, as a boundary condition, into the Hungarian water regulation, in consideration of actual changes in the climate, and into international forms of cooperation and foreign policy (bi- and multilateral international cooperation to share water resources the availability of which gets changed by climate change).",1.0,explorer
CCLW.GST.595.595,11b29be621d4932b2bdf967901ee1a6c__8d0a2cefacda2c58192cd0f96a1e000fd619f766b6f0bc512784390ccda161b3,INTERNATIONAL_COOPERATION,,international cooperation,63,88,• It is recommended to establish bi- and multilateral forms of international cooperation in order to share the water resources that will change and will be available in case of the climate change.,1.0,explorer
CCLW.GST.1054.1054,5f4c1dd6b787ed561042b8f8552a60ac__fec6f9ef6eaa17fa1e9a6f7ee83c8a7583dab21b2bd07c95d6ed3f1a2592b42b,INTERNATIONAL_COOPERATION,,International Cooperation,1526,1551,"During the technical analysis, Montenegro clarified that the information that was reported in the BUR was provided from the Directorate for EU Integration and International Cooperation of MSDT.",1.0,explorer
CCLW.GST.574.574,c0fcec4c656b84d680d61a59167beb90__16446d04ecb9c0ce1094085eaa4878e28dccf3755af9dd9c6b4e415840dc3721,INTERNATIONAL_COOPERATION,,international cooperation,67,92,Gesellschaft für Technische Zusammenarbeit (German federally owned international cooperation enterprise),1.0,explorer
CCLW.GST.776.776,f6ec8f55d34ae4f8e29f92abda78e95f__f33e7ae93f71de282a3fdb0e05d6b560f5d56d33d789bb5bac1ce13c2ab32c5a,INTERNATIONAL_COOPERATION,,International Cooperation,247,272,"Under the new system, the Ministry of Foreign Affairs and International Cooperation is seen to give guidance in the definition of cooperation policies, while the Italian Development Cooperation Agency, established following the reform, is in charge of implementing policies.",1.0,explorer
CCLW.GST.776.776,9547578ac10105b798b57b43f832e7b0__c0355270ae93648007d8c957b4f1ba4c04f3afe729227aa7e99893340d97b3a7,INTERNATIONAL_COOPERATION,,International Cooperation,138,163,"An integrative approach to environment and development has been adopted in development actions run by the Ministry of Foreign Affairs and International Cooperation (MFA), housing the traditional development cooperation originally focused on social and economic challenges.",1.0,explorer
CCLW.GST.776.776,9ab0b37de999379b362727724ddbc8df__a5da015c27c6a478ec97ef5538922a5907772c92490c6be4de257cce2119b944,INTERNATIONAL_COOPERATION,,International Cooperation,427,452,"The strategy underlying the identification of priority countries, defined jointly with the Ministry of Foreign Affairs and International Cooperation, the Italian Agency for Cooperation and Cassa Depositi and Prestiti, has involved mainly the Sub-Saharan Countries (Eswatini, Kenya, Mali, Zambia, Mauritius, Sao Tome and Principe, Seychelles) including an Intergovernmental organization (Lake Chad Commission) and a minor quantity of other territories, such as: MENA region (Tunisia, Jordan, Unites Arab Emirates), Eastern Europe region (Kazakhstan, Kurdistan, Russian Federation, Georgia), Central/Latin America region (Argentina, Cuba, Paraguay) and Asian region (India, Vietnam).",1.0,explorer
CCLW.GST.776.776,1626e16841c6e594942db5ab53751691__b2b6438d019ab7b1adaead48896414832bc102f14dee0072ee77166ee23f94eb,INTERNATIONAL_COOPERATION,,International cooperation,13,38,"Multilateral International cooperation of IMELS has been strengthened through its participation in funds
and programs promoting renewable energy, energy efficiency and resilience to climate change.",1.0,explorer
CCLW.GST.776.776,dbba81996e8f5124928810bd0a2e0a2c__08e7e2828abd99b6cbe21b1d5c401ce4d07ece2d5d2e8054a8f4e1160df62b98,INTERNATIONAL_COOPERATION,,International Cooperation,480,505,"The Memorandum of Understanding between IMELS and the Governments of the Pacific Small Island Developing States participating to the project ""Co-operation on climate change and on the clean development mechanism under article 12 of the Kyoto protocol"", was signed in New York on 11 May 2007 and subsequently extended and signed by all Parties and currently includes among donors: the Italian Ministry for the Environment, Land and Sea (IMELS), the Ministry of Foreign Affairs and International Cooperation of the Italian Republic, the Grand Duchy of Luxembourg, the Ministry of Foreign Affairs and Cooperation of Spain, the Federal Ministry for Europe, Integration and International Affairs of the Republic of Austria.",1.0,explorer
CCLW.GST.776.776,21468ea58e4b5f706a94e64a97708617__166d25099d173eb681bdcea0652be2a81dd03375b4c9f494ad3d5e8184752935,INTERNATIONAL_COOPERATION,,International Cooperation,338,363,The specific approach by the Ministry of Foreign Affairs and International Cooperation (MFA) is therefore characterized by the integration of climate change in 2030 Development Agenda.,1.0,explorer
CCLW.GST.776.776,e30dbd61cf4d322d077c59a360c05735__079ca8fd7ee3258b87646123e165f6561c09131baadb1bb13c8b5daaa2f5da94,INTERNATIONAL_COOPERATION,,International Cooperation,76,101,"Under the new system, the Ministry of Foreign Affairs and International Cooperation provides guidance in the definition of cooperation policies, while the Italian Development Cooperation Agency, established following the reform, is in charge of implementing policies.",1.0,explorer
CCLW.GST.776.776,e30dbd61cf4d322d077c59a360c05735__079ca8fd7ee3258b87646123e165f6561c09131baadb1bb13c8b5daaa2f5da94,INTERNATIONAL_COOPERATION,,International Cooperation,499,524,This Law provided for a gradual increase in resources for development cooperation over a three-year period as stated in the Three-Year Programming Document 2016-2018 of the Italian Ministry of Foreign Affairs and International Cooperation - MAECI) 52.,1.0,explorer
CCLW.GST.776.776,6aa90a8894a020bc207a84b1dd134d29__eb459e2f0e927898f59ad5c0be3cef4b8ae593d20dfbd8e65debf4796be2126e,INTERNATIONAL_COOPERATION,,international cooperation,4,29,The international cooperation activity carried out by IMELS is very diversified both bilaterally and multilaterally.,1.0,explorer
CCLW.GST.776.776,afe28f9b8627ec7b478b4f65ae187ca9__5ab3b8432d5a4c5a9fbd9b372982697b71a05a05dbf9cf2bac8efd50916e512c,INTERNATIONAL_COOPERATION,,International cooperation,13,38,"Multilateral International cooperation of Italian Ministry for the Environment, Land and Sea has been strengthened through participation in funds and programs promoting renewable energy and energy efficiency and resilience to climate change such as through the International Finance Corporation of World Bank (Clean Energy Access Program Trust Fund and MENA - Middle East and North Africa - Inclusive Green Growth Initiative) and the African Development Bank (Africa Climate Change Fund and Sustainable Energy Fund for Africa).",1.0,explorer
CCLW.GST.776.776,ac127bfd73fcf55687f0421122e5e39b__57ffb48e510bf74253ce819218e96a8f124109a66aa4378db3399068d5dce7f5,INTERNATIONAL_COOPERATION,,international cooperation,229,254,"In this area
enhanced action and international cooperation on adaptation is needed to enable and support the
implementation of adaptation activities aimed at reducing vulnerability and building resilience.",1.0,explorer
CCLW.GST.843.843,53c3afa5b3bd828fdac337f999c67649__7875f23757d39ba94a1eee1aac89f167e21516706f48a2b4265ac44dbc2fe88f,INTERNATIONAL_COOPERATION,,International Cooperation,1123,1148,The program was created with support of the Ministry of Environmental Protection and Agriculture of Georgia and German International Cooperation Society (The Deutsche Gesellschaft für Internationale Zusammenarbeit (GIZ)).,1.0,explorer
CCLW.GST.161.161,bba6d1a27f2ad23fea34fc13d8f19e41__2c7d10044dd5d4e2581004ae5b1638acb7afbeb3d6e0f757da864e827aea3685,INTERNATIONAL_COOPERATION,,international cooperation,11,36,ARGO is an international cooperation program that provides many valuable data for forecasting weather and ocean conditions and phenomena.,1.0,explorer
CCLW.GST.161.161,c2ba18ca90e9c32d873cdb9cb68652bb__c87e45a523502013beb2727cfe67255ba244dc4d3c94f37e431215051c72e4d9,INTERNATIONAL_COOPERATION,,INTERNATIONAL COOPERATION,27,52,UNESCO-WMO ARGO INTERNATIONAL COOPERATION PROGRAM,1.0,explorer
CCLW.GST.161.161,b6180f1b5f4f592ddfa6c1a1fc61329a__e907a27f9178778d7320372b41fc63994b9c595163c9f171c0dc999ea784e926,INTERNATIONAL_COOPERATION,,international cooperation,559,584,"In the same vein, the Gabonese counterpart, a requirement within the framework of this international cooperation program, has not yet been included in the 2009 and 2010 Finance Laws.",1.0,explorer
CCLW.GST.161.161,08ecd90f437b4e6125e532781caf7bed__864068bf129d172e97bec046e16be65509ee65a507296e2346b6cfa6d2826b61,INTERNATIONAL_COOPERATION,,International Cooperation,37,62,"In March 2007, Gabon joined the Argo International Cooperation Program at the end of the seventh Session of the Consultative Body of Experts on the Law of the Sea of the Intergovernmental Oceanographic Commission (IOC) of UNESCO held in Libreville.",1.0,explorer
CCLW.GST.161.161,52a5dc6fb4e1b411d7d5357ceeb4fa2e__a5f2c2f3c81c8838feabf0093fb985233a05d8d8ceabe1b09cadf1276f916b3f,INTERNATIONAL_COOPERATION,,international cooperation,66,91,• The operational oceanography project developed through the Argo international cooperation program has a network of three SOLO brand sub-surface buoys in Gabon.,1.0,explorer
CCLW.GST.513.513,8a8dd256386d91dfec20199b5e620e68__b6472a111f2ec31324c9a3f6ba6ff67bdec8552a49b19d52e0262fb2b574fcc2,INTERNATIONAL_COOPERATION,,international cooperation,297,322,"The outcome shall inform Parties in updating and enhancing, in a nationally determined manner, their actions and support, as well as enhancing international cooperation for climate action.",1.0,explorer
CCLW.GST.203.203,f6f4ad099f09b9730ded2b76c68ec50c__95c024bced3d88db7df7d4c9b6de43d28b0899524acac9edfe22cf2f702c403b,INTERNATIONAL_COOPERATION,,international cooperation,548,573,"Likewise, in both periods the additional results that could be achieved with the support of international cooperation and the financial mechanism of the UNFCCC are considered, understanding cooperation as financing and technology transfer.",1.0,explorer
CCLW.GST.691.691,1c5f24526b1e2b75c72fa1aa4894aae4__5922e0b0d915b05731aa09c6f72bcbac5bc71592c3bcf3497d931a8fbebcf983,INTERNATIONAL_COOPERATION,,International Cooperation,94,119,Funding for the project was provided by the Japan International Cooperation Agency under its grant aid for environment and Climate Change programme.,1.0,explorer
CCLW.GST.691.691,f28315390ff229164e8e87ecd9cd52bf__fd3d9582803f6dab10b48f566e758bec50335afabc60647e138e02c84d9b9d82,INTERNATIONAL_COOPERATION,,International Cooperation,33,58,by German Federal Enterprise for International Cooperation (GIZ).,1.0,explorer
CCLW.GST.514.514,e232f0c687f825e6b98d5234afe4ffab__180d37602756a9ef3bf4b8690e6da421dec782aed16f1c39933b96b156845be0,INTERNATIONAL_COOPERATION,,International Cooperation,178,203,"Thus, the MET and its Climate Change and International Cooperation Department (CCICD) are the national entities with overall responsibility for organizing and coordinating the compilation of National Communications, Biennial updated reports, GHG inventory and submitting them to the UNFCCC Secretariat through the National focal point for the UNFCCC.",1.0,explorer
CCLW.GST.514.514,5bc48af97b076c2f2596b41353d5bab9__761e6dbc0ca76f8fa0f77f5f62442b8543f0d6a2b149bc9b323904735e3dabff,INTERNATIONAL_COOPERATION,,International Cooperation,461,486,Mongolia has just started a project with Japan through the Japan International Cooperation Agency (JICA) on Mongolia's GHG inventory system improvement and capacity building.,1.0,explorer
CCLW.GST.514.514,0cb53e70ea22e1dd27a95c49ff170b71__3cd937e526026c697624c1ddac850981de3787ba5d8fcb42d498e1f212f7afce,INTERNATIONAL_COOPERATION,,International Cooperation,217,242,"In 2006, was developed Project ""The Study on Solid Waste Management Plan for Ulaanbaatar City in Mongolia by Japan International Cooperation Agency (JICA).",1.0,explorer
CCLW.GST.71.71,b4d261e0c243414f7d12b341267694c2__a1f3a689e9f683b63539363221e2354b5e528b81241d64c88a881c412948976e,INTERNATIONAL_COOPERATION,,International Cooperation,347,372,"Tafaigata landfill uses the Fukuoka method (a semi aerobic landfill structure) of waste disposal, as introduced to Samoa by the Japanese International Cooperation agency (JICA).",1.0,explorer
CCLW.GST.71.71,472acf0c8ea381c9db729a7ffdad7985__8ba6942ed306fd311e459bb982923031c21a52b1b449620b4b79785784f196e5,INTERNATIONAL_COOPERATION,,International Cooperation,115,140,"In 2005, one automatic weather station was installed at Mulinu'u as part of technical assistance from the Japanese International Cooperation Agency (JICA).",1.0,explorer
CCLW.GST.415.415,06df40dc1eb36a41bcb41367b69788fd__d0de6ea891e5143122e129f902ae35674fa7314de3638f30b895a204105971cc,INTERNATIONAL_COOPERATION,,international cooperation,18,43,"Strengthening the international cooperation on adaptation of the trans boundary water basins; Awareness raising on the socio-economic impacts of climate change, including a problem of increasing water deficit.",1.0,explorer
CCLW.GST.415.415,205b840bb0225ecba31c05f5e235db46__33d1f5ecdcb7ab1508ceb09dce670897e06cd117a1b1783336cf198b8e8b6e0f,INTERNATIONAL_COOPERATION,,International co-operation,0,26,"International co-operation is needed for the monitoring of cross-border air pollution, allowing information from the global data centers of the trajectories of pollutant transport to be acquired in a short time.",1.0,explorer
CCLW.GST.415.415,b30b02661787ed1bee91225c77840302__006aeb4fe21e9a15e30aa4130143e369e5a4df381edc91d209037843f139917b,INTERNATIONAL_COOPERATION,,international cooperation,884,909,"The website of Climate Center has a news line and a section called ""Kyrgyzstan and Climate Change"", which provides information on the activities of the Coordination Committee on Climate Change; updated information on the cross-sectoral partnership and international cooperation; a large section on the legislation of the Kyrgyz Republic in the field of climate change, as well as information on the geography and climate of the Kyrgyz Republic.",1.0,explorer
CCLW.GST.158.158,65d329d3ff39b8f1f4b8dabf67f8e52a__80f9e1b5d75e7f1cf8d010c75dcb655ccad59ca42359f2df90c3ca0d927a0317,INTERNATIONAL_COOPERATION,,International Cooperation,6,31,Japan International Cooperation Agency,1.0,explorer
CCLW.GST.158.158,a6742425f119b9183745587319b104c2__1fb08bb5bbcd364b3346bfdd7791d5b406a093b1169b62ea356a5fc06eb43b11,INTERNATIONAL_COOPERATION,,international cooperation,23,48,"GEF is a mechanism for international cooperation for the purpose of providing new, andadditional,
grant and concessional funding to meet the agreed incremental costs of measure to achieve agreed
global environmental benefits.",1.0,explorer
CCLW.GST.617.617,dc221641a0e6a32ccd9dd093f2da6dd0__86af86f1e8a8013f7def727a3e4cfe1ebabe0302f9b69e188305434838e07cba,INTERNATIONAL_COOPERATION,,international cooperation,272,297,"Information on matters related to technology development and transfer, including the information referred to in Article 10 of the Paris Agreement, barriers and challenges faced by developing countries and good practises, experiences and potential opportunities to enhance international cooperation on mitigation and adaptation",1.0,explorer
CCLW.GST.617.617,acb5202a747b1614514d15c8b2dfe1c0__8153d51b05b6fe5c1477c2119764ea59b88ce85b7ac9f9f61da802056be36019,INTERNATIONAL_COOPERATION,,International cooperation,272,297,International cooperation is a critical enabler for developing countries and vulnerable regions to strengthen their action for the implementation of 1.5°C-consistent climate responses.,1.0,explorer
CCLW.GST.617.617,fbc3a01d1740e4e34ee0cf2aa2ad7fd5__7b4bacb1a88bf8b64c2e820e5502a81e937e1d34fcaf2894a0ff47726c9e1943,INTERNATIONAL_COOPERATION,,international cooperation,27,52,Opportunities for enhanced international cooperation,1.0,explorer
CCLW.GST.617.617,14c73f31ac907912c76dc78d3549c83c__cd998f31593fd3b23b14e93278d8ab0227a1aeb7d39af9d34e0b2bdaa6a28405,INTERNATIONAL_COOPERATION,,international cooperation,67,92,"Good practices, experience, and potential opportunities to enhance international cooperation on mitigation and adaptation and to increase support under Article 13, para.",1.0,explorer
CCLW.GST.617.617,03de32ab92eb6b9c4baf71608cf18f1b__df8d53d3e3dd156cec233d33fb1b84e465a945c5fb6c5f21f5548bdc21fa1f25,INTERNATIONAL_COOPERATION,,international cooperation,31,56,(c) Opportunities for enhanced international cooperation between countries on technology development and transfer.,1.0,explorer
CCLW.GST.617.617,da67f5610effb5f7ceaa787584098b62__aeb80cc5584e816669d79703725533ba2a6e0ff98c953e11eb224a762248df26,INTERNATIONAL_COOPERATION,,international cooperation,95,120,"These three subjects (achievements, challenges and solutions learned and opportunities for
international cooperation) will form the core chapters of this report, which is further explained in
the next section.",1.0,explorer
CCLW.GST.617.617,5b6a0a3e23fb9f888467e5d79c6113c1__6b5b8a2c951e30b889209fcea2dec5d9083c6ed5d94a133972d28953193a1236,INTERNATIONAL_COOPERATION,,international cooperation,106,131,"What are good practices, experience, and potential opportunities to enhance climate action, including international cooperation, on mitigation and adaptation and to increase support under Article 13, para.",1.0,explorer
CCLW.GST.617.617,3ed1441e6db7e762c5f7093748976c02__1e54d1ac64e7c6488dfcb713ba81bb384db6616ff4042adb96e456407b1a5424,INTERNATIONAL_COOPERATION,,international cooperation,139,164,"(d) Chapter V takes a forward-looking perspective by exploring ways to support climate technology RD&D and implementation through enhanced international cooperation, including between developing and developed countries.",1.0,explorer
CCLW.GST.617.617,584939f8babde44047040d72e727af48__bbebdf1e02d472d5379e6d6b43f4e55da22a62bcd22417ef06007ea727fecd97,INTERNATIONAL_COOPERATION,,International cooperation,4,29,(e) International cooperation and support on meeting technology needs to enhance implementation of TNA results.,1.0,explorer
CCLW.GST.617.617,15204b5722d605fe7171e6eb9b37ee5e__7a2861676c47bbbd4b3119c81af642d19cfb513bf9551738fc23cb41de8fc057,INTERNATIONAL_COOPERATION,,international cooperation,89,114,"Concerning the second guiding question, this Chapter will not particularly focus on international cooperation as a measure to transfer or replicate good practice, experience, and potential opportunities.",1.0,explorer
CCLW.GST.617.617,5b8e9936f500ee9e602a6783879477a3__513f7dfe28e1ac50b6154c7309b2ff898a5344741e70075bc4f9039391f06efb,INTERNATIONAL_COOPERATION,,international cooperation,106,131,"(b) What are good practices, experience, and potential opportunities to enhance climate action, including international cooperation, on mitigation and adaptation and to increase support under Article 13, para.",1.0,explorer
CCLW.GST.617.617,ffbfa5950afe123ea644ebeecf97fcc7__5341a784d6dc24a799e35757ec5b79e601c9ce70575fe698eead37df146fe407,INTERNATIONAL_COOPERATION,,international cooperation,338,363,"This chapter focusses on how the thus identified good practices, experience, and potential opportunities to enhance climate action, can be strengthened through international cooperation on mitigation and adaptation.",1.0,explorer
CCLW.GST.617.617,ffbfa5950afe123ea644ebeecf97fcc7__5341a784d6dc24a799e35757ec5b79e601c9ce70575fe698eead37df146fe407,INTERNATIONAL_COOPERATION,,international cooperation,569,594,"What are potential opportunities to enhance climate action, including international cooperation on mitigation and adaptation and to increase support under the Art.13.5 of the Paris Agreement?",1.0,explorer
CCLW.GST.617.617,505d559ec354ee647b81809cf27618d2__b2b9aee692618f7267731e9c8b1c76f1cca794c0c42f9573b192c73f0439bfbd,INTERNATIONAL_COOPERATION,,international cooperation,171,196,"is enabled by national innovation policies fostering the innovative uptake of climate technologies and capabilities for their deployment (e.g., industry and finance), and international cooperation.",1.0,explorer
CCLW.GST.617.617,d394bd4597683a7f98172d90bc50088d__4244a5860d73b9591b26d86327a8a8858cce6dedec17e865862c4dbf2df6ad5c,INTERNATIONAL_COOPERATION,,international cooperation,48,73,"209. IPCC (2018, p. 23) particularly highlights international cooperation as a ""critical enabler for developing countries and vulnerable regions to strengthen their action for the implementation of 1.5°C-consistent climate responses, including through enhancing access to finance and technology"".",1.0,explorer
CCLW.GST.617.617,d394bd4597683a7f98172d90bc50088d__4244a5860d73b9591b26d86327a8a8858cce6dedec17e865862c4dbf2df6ad5c,INTERNATIONAL_COOPERATION,,international cooperation,341,366,This chapter elaborates on the potential of international cooperation between countries to strengthen climate technology development and transfer.,1.0,explorer
CCLW.GST.617.617,fb1e5f84006f4b077877e730c69e5315__48b47d4cdf8e9c85c34be3132cb7315bdc9045594bf721afb6c5b03d899036fd,INTERNATIONAL_COOPERATION,,international cooperation,204,229,"This chapter contains key findings from this paper based on achievements by the TEC, thereby building knowledge of good practice for coping with climate technology challenges and identifying ways of international cooperation to disseminate this good practice within developing countries.",1.0,explorer
CCLW.GST.617.617,c426555bbfd9857300576934f3256e13__0781b7e523e18ca2513e487741039458dd6018268feadce6fbc03d091cbd11f2,INTERNATIONAL_COOPERATION,,International cooperation,4,29,"(a) International cooperation for climate technology RD&D supports technology development and transfer in developing countries, in particular when the programmes are aligned with national priorities, needs and capacities of participating (developing) countries.",1.0,explorer
CCLW.GST.472.472,f66355bc174b5cd4c5a7be467d8dcc80__5c4ba98afe1a2bfebb1f25d911e120f4246df2181dbfa64d53b24f25a4f2d1ff,INTERNATIONAL_COOPERATION,,international cooperation,833,858,"FNC does not cover the holistic assessment of climate change impact, climatic vulnerabilities and mitigation and adaptation requirements, mainly due to lack of information and data availability; however due to Vanuatu's limited technical and financial capacity and the global nature of climate change and sea level impacts, identify and seek role for further international cooperation in meeting the mitigation and adaptation goals and on-going work to minimise increases in emissions.",1.0,explorer
CCLW.GST.472.472,85f63304f29baaccfd5da9a1e6d1cd9c__c449e73e7e21a7f5e31e4f13490d0dd749be4ce1cf4184565bb91ad2d415554c,INTERNATIONAL_COOPERATION,,International Cooperation,24,49,"Undertaken by the Japan International Cooperation Agency (JICA) in 2011, an audit of daily household waste in Port Vila shows a rate of 0.427kg.",1.0,explorer
CCLW.GST.823.823,1562a303ad50045757bb3ca02bf76d46__40b27d2dc46f6119404174c2f68303b563f5c34b64dfb5cea0446d0d2f5bcefc,INTERNATIONAL_COOPERATION,,international cooperation,46,71,Panama is firmly convinced that it is through international cooperation that we can achieve the stabilization of greenhouse gas concentrations in the atmosphere at a level that prevents dangerous anthropogenic interference in the climate system and always working towards the 1.5° objective.,1.0,explorer
CCLW.GST.823.823,c7db80f27025b22c47ed028561ad5e3a__b3ddfd190a239a484ac14ca8e619cbc69b1d9c8251bbc619a22eb2b13c3cca2f,INTERNATIONAL_COOPERATION,,international cooperation,55,80,"For example, what national and international cooperation instruments are available and used in Panama?",1.0,explorer
CCLW.GST.823.823,4d08cdf4d9dbd7ec0955ad022b55473d__d8e96d91b192bea59b3846ea1b08b6b1f251499bce505b011d82dcd6997e0684,INTERNATIONAL_COOPERATION,,International Cooperation,63,88,"Within the framework of Japanese cooperation through the Japan International Cooperation Agency (JICA), the following technical cooperation projects related to climate change adaptation and mitigation stand out: i) Community Participation in Development and Management Integrated of the Alhajuela Lake sub-basin (2006-2011); ii) Improvement of wastewater management in the metropolitan area of Panama (2015-2018) and iii);",1.0,explorer
