document_id,text_block_text_hash,type,id,text,start_idx,end_idx,sentence,pred_probability,annotator
CCLW.GST.544.544,26fe38fba343dc32dda22e5d692ba1e1__bc275850f5ea480470614f8f359b8e2d892714c24cdb28e375990ab402ad9034,INTERNATIONAL_COOPERATION,,international cooperation,369,394,"As a result of national investment and international cooperation, the country has expanded its potential for systematic observation.",1.0,explorer
CCLW.GST.544.544,5a573d3c6b443522f3968cf90952e4e7__a423f9bc435be9489daa4ea56e413522889f139eb66b4b4f28e7a4b847ca4f1b,INTERNATIONAL_COOPERATION,,international cooperation,277,302,"In this Angola is part of the international cooperation project AMESD - Environmental Monitoring for Sustainable Development in Africa, financed by the European Union and benefiting 48 African countries.",1.0,explorer
CCLW.GST.544.544,8b0f2e60440e5fe3c82e62efcb3ec87f__637a863bfa91b60f2408aa9d00193de1804fad9ce2fb1f3449c7288fdfc019ef,INTERNATIONAL_COOPERATION,,International cooperation,2,27,International cooperation in solving environmental problems;,1.0,explorer
CCLW.GST.873.873,ccb9ef6751d9e9f945d8e6b500fdb714__7cdbcbe2a90246bd43a90a839d49d33349a8b2c4cd5078f1f3a56aab1c5ec7be,INTERNATIONAL_COOPERATION,,International Cooperation,504,529,"The information reported indicates that the Party has made significant developments in designing its domestic MRV system since its previous BUR, with help from the German Agency for International Cooperation as part of the Information Matters: Capacity-building for Ambitious Reporting and Facilitation of International Mutual Learning through Peer-to-Peer Exchange project.",1.0,explorer
CCLW.GST.873.873,cf612fcd61af312b98e6c5d327ad2a94__0c48f7efc1393ef6a275e25c25280d0636135bf0f3dfbba16a02c4cbc82ce912,INTERNATIONAL_COOPERATION,,International Cooperation,705,730,"The information reported indicates that Georgia received capacity-building and technical support from UNDP, the German Agency for International Cooperation, Norway, the European Union and the European Bank for Reconstruction and Development.",1.0,explorer
CCLW.GST.746.746,a2b20eddd963e5e69815d17cc5c10500__c58f6b46f4de3ae609d17104865af5f14f09304ab6f4811119834d2e5d4de397,INTERNATIONAL_COOPERATION,,international cooperation,80,105,"The GTS process: How to organize the GST to enhance national climate action
and international cooperation",1.0,explorer
CCLW.GST.746.746,ef84611fd18043a4b916ab558a5b6667__b1c228cee891eb0694baea1376df3634962f86fd6a45eed2246d8800db01b3ce,INTERNATIONAL_COOPERATION,,international cooperation,221,246,"The inputs IDDRI is submitting to the second information collection of the Global Stocktake, are concerning (1) the form in which we suggest the GST process itself could be improved to enhance national climate action and international cooperation, and (2) specific substance topics that have been overlooked or less covered in the first submissions and Technical Dialogues.",1.0,explorer
CCLW.GST.746.746,e2104ebbdebcec0b41081b2d3a57ede9__d2a5bf13eb2d65e4a9dda53cbc88c8e56f5828da34251163c2be307b4b61a03a,INTERNATIONAL_COOPERATION,,international cooperation,63,88,How to organise the GST to enhance national climate action and international cooperation,1.0,explorer
CCLW.GST.746.746,42f591428b141d25aa5826988f6fc3a5__aa4d361fd2289d72e3c62296bde29830fa1c58abe419e3c8901c5c4d2291e34f,INTERNATIONAL_COOPERATION,,international cooperation,63,88,"How to organise the GST to enhance national
climate action and international cooperation",1.0,explorer
CCLW.GST.746.746,40e35d97f74a4f5aca6e1f40dd132e76__55125a16c521aed49993ecaf44276fc9cda7bccd4a4e44cbc7ffa5bba0bbd16b,INTERNATIONAL_COOPERATION,,international cooperation,59,84,"The effective strengthening of national climate action and international cooperation - two primary objectives of the mitigation stream of the GST-requires acknowledging systemic transformations consistent with long-term global carbon neutrality, identifying concrete actions supporting them and promoting the coordinated adoption of these actions by a diversity of actors.",1.0,explorer
CCLW.GST.746.746,6d824f09ccb8000eae77f1f22f9492d9__36170301210d2735d95b79c4544fd04a1660c4d6c550bc0d0a0d8ccc40a2cd35,INTERNATIONAL_COOPERATION,,international cooperation,227,252,"Beyond the identification and participation of the policy-relevant players to the discussion, the remaining challenge is to orchestrate a dialogue strategy which could produce insights for enhancing national climate action and international cooperation.",1.0,explorer
CCLW.GST.422.422,939dcceefbcb3a41e55d15c8d1870c44__994430144f695cbe5407a908e35aaa27b867442b1d0b946cc6112f6c1f4b91fd,INTERNATIONAL_COOPERATION,,International Cooperation,54,79,Section 3: Business-led International Application and International Cooperation,1.0,explorer
CCLW.GST.422.422,276fda10cee1659f6da3ac7f1a7ad5f5__16e2da4cbecbe72fec15c1d11ddd15be33df5e175ca7499ba49989e75a67f9b4,INTERNATIONAL_COOPERATION,,international cooperation,649,674,"Furthermore, it is also important to promote ""business-led promotion of international application and international cooperation"" with a view to offering products and technologies of excellent environmental performance globally.",1.0,explorer
CCLW.GST.422.422,8556cb002de92251cb00cce19b1faf5a__48cda91e9dfebd5fd16e8ed379496d8027a6fadc44aab087894eea29856c0fc7,INTERNATIONAL_COOPERATION,,international cooperation,316,341,"To serve for such a mechanism, this strategy comprises of three major pillars of measures: the ""promotion of innovation"" to realize a business-led virtuous cycle of environment and growth; the ""promotion of green finance"" to direct financial flow into innovation; and the ""business-led international application and international cooperation"" as a means for sharing the outcomes of innovation world-wide.",1.0,explorer
CCLW.GST.422.422,f3359432117ff632370db978341ba35f__654462311acab5374b3eb114ee0f54993d247459291fec1c0b819842545d141c,INTERNATIONAL_COOPERATION,,international cooperation,1131,1156,"The Government will strategically support researches to unravel the mechanisms of climate change and assess the environmental, economic and social impacts of climate change, aiming for international cooperation where appropriate.",1.0,explorer
CCLW.GST.422.422,f3359432117ff632370db978341ba35f__654462311acab5374b3eb114ee0f54993d247459291fec1c0b819842545d141c,INTERNATIONAL_COOPERATION,,international cooperation,2151,2176,Japan will also carry out international cooperation by making use of the above-mentioned strengths.,1.0,explorer
CCLW.GST.422.422,85e3d34806ecf3ffda4675ae87d60e7f__f9e85495748cfd728fbe142ce4a0ffb827cecd218dabd1ad023256e315a9e0e5,INTERNATIONAL_COOPERATION,,international cooperation,839,864,"Bearing in mind that enhanced resilience by introducing sustainable and resilient infrastructure will improve the investment environment for the private sector, it is also important, in the context of international cooperation, for the private financial flow towards addressing climate change issues in developing countries to activate.",1.0,explorer
CCLW.GST.422.422,abc4021fb2a76b9f4b5c8ea7fae85757__cefc47c068f2dd70c0661a3558d54c2cfaa33fb0bbbec53179945a71deb6f55d,INTERNATIONAL_COOPERATION,,International Cooperation,86,111,"assistance modalities of Japan International Cooperation Agency (JICA), Japan
Bank of International Cooperation (JBIC), Nippon Export and Investment
Insurance (NEXI), and Japan Oil, Gas and Metals National Corporation
(JOGMEC).",1.0,explorer
CCLW.GST.422.422,abc4021fb2a76b9f4b5c8ea7fae85757__cefc47c068f2dd70c0661a3558d54c2cfaa33fb0bbbec53179945a71deb6f55d,INTERNATIONAL_COOPERATION,,International Cooperation,31,56,"assistance modalities of Japan International Cooperation Agency (JICA), Japan
Bank of International Cooperation (JBIC), Nippon Export and Investment
Insurance (NEXI), and Japan Oil, Gas and Metals National Corporation
(JOGMEC).",1.0,explorer
CCLW.GST.422.422,d713e672a095c20d28d76a7d32d79e62__00105bd9b9289082313a6e8a25594082c248d2975d9f866f49381cd2687e3985,INTERNATIONAL_COOPERATION,,international cooperation,55,80,"As the weight of energy consumption in Asia increases, international cooperation on climate change measures and energy policies, together with specific collaborations, will become more important than ever.",1.0,explorer
CCLW.GST.422.422,035d03bc674396c7b5b9f237b20b49fe__29321a3b51886dfc2b37b01023fbe1afb752a4900971bc2c6fe050bebe37b0b6,INTERNATIONAL_COOPERATION,,international cooperation,542,567,"The OOF will be primarily used for Japanese companies seeking opportunities abroad, and ODA such as Private Sector Investment Finance will be used for international cooperation to support developing countries; the synergy between the two modalities to mobilize private finance and create impact will be sought.",1.0,explorer
CCLW.GST.892.892,52046f298f5904dd87bd51b38155726a__c2783e31691c19221156f3ff1b394326dfbf45991b35be13acfd2c468c3577a8,INTERNATIONAL_COOPERATION,,International Cooperation,6,31,"Japan International Cooperation Agency (JICA), 2012.",1.0,explorer
CCLW.GST.892.892,c2f82e6a53365338c7ef46ffffa50c6a__ca7ec3042190c77b40325f17e071383ee25f9d1993db9d76dfa47aca54fdbddc,INTERNATIONAL_COOPERATION,,International Cooperation,6,31,"Japan International Cooperation Agency (JICA), 2006a.",1.0,explorer
CCLW.GST.892.892,994289a6925780ea3b115dd531ece541__a5c22ee4e5fd4f56e694cb2ab34302dc9aede13a10b70617c900fcdc180cbdee,INTERNATIONAL_COOPERATION,,International Cooperation,6,31,"Japan International Cooperation Agency (JICA), 2006.",1.0,explorer
CCLW.GST.1032.1032,2cb4f19e1d933c5cb4fc5fe42c19b3c1__b12f903e640cbd0e1834e10184ae0c4ac0900f76846300a16ef2b314f08d2ae7,INTERNATIONAL_COOPERATION,,INTERNATIONAL COOPERATION,0,25,INTERNATIONAL COOPERATION ON CLIMATE,1.0,explorer
CCLW.GST.1032.1032,02978f850054551cd20eb2bee97ff9e8__b5960355864e11d9e2e57e091de79693c1dd20bfc2450a6329b3c8ca98b7e368,INTERNATIONAL_COOPERATION,,International cooperation,814,839,"International cooperation can also significantly lower the costs of decarbonization and create economic opportunities for people and businesses, all while reducing the risks and impacts of climate change.",1.0,explorer
CCLW.GST.1032.1032,cf07442899cca8640d2b4a79393b6b27__4028d8c0920d06f248f1df9ef4bba58f6226c801ef173c62e6b8e0df61febe95,INTERNATIONAL_COOPERATION,,international cooperation,178,203,"As the world's largest economy and the pacesetter in so many areas of international cooperation, the United States' continued leadership on climate change is needed to galvanize the international community.",1.0,explorer
CCLW.GST.1032.1032,102754a1dd529b90eddd5651e86915ef__667fd9d94aa1aa27eb810fd23dbfce2ed8ce5d3f7201b242b18d3a14a934bd0f,INTERNATIONAL_COOPERATION,,international cooperation,193,218,"In the land sector, international cooperation under the UNFCCC Reducing Emissions from Deforestation and Forest Degradation (REDD+) framework is already helping to ensure that reductions in unsustainable logging in one country are not negated by increased logging elsewhere.",1.0,explorer
CCLW.GST.176.176,63d15a568f45fcdead509ed82b96f37f__f07d7674ff63a7abdc9c34b4f70508333228c1bcc6e7d713c641b9d5d1bc923e,INTERNATIONAL_COOPERATION,,International Cooperation,1058,1083,"Delegates from the Secretariat of Environment, Water and Climate Change, the Ministry of Social Development, the Uruguay Institute of Meteorology and the Uruguay Agency for International Cooperation participate as guests.",1.0,explorer
CCLW.GST.176.176,00464335464697a933a230f5586af3d4__4b0bb54bdfa356659bb0118ff612019e20c6d9db774101a1af5d759ad5b1abf0,INTERNATIONAL_COOPERATION,,International Cooperation,1167,1192,"During the technical analysis, Uruguay clarified the type of support received within each project, including specific information about the type of support received (technology transfer, capacity-building, technical support) and further explained that the new arrangement with the Uruguay International Cooperation Agency, which depends on the Presidency of the Republic, has improved the collection of information.",1.0,explorer
CCLW.GST.738.738,7c6ab791117b00cbe84b029a870df3fc__f6ecd863a151b6775f69774140d49b50dc6a8cbc0a9548de6d30080e7e5d7d0f,INTERNATIONAL_COOPERATION,,International Cooperation,407,432,"The Food and Water Security Strategy of 2013, was developed by
Ministry of Planning & International Cooperation.",1.0,explorer
CCLW.GST.738.738,c0745e8e6dcf35cafb6091b8cd1d3a4b__68bbf9e50152af8c15eb5710d00df09ab1a854f54ed111e0648d129676c3cf02,INTERNATIONAL_COOPERATION,,International Cooperation,388,413,"Right to development; iv)Total Economic Value, v) Sustainable Resource Use; vi) Equity, vii) Public participation; viii) Subsidiary, ix) Precautionary Principle Polluter; x) International Cooperation and good governance; xi) Benefit sharing; xii) Community Empowerment.",1.0,explorer
CCLW.GST.738.738,f6b1960a81747f48f15e7a40d6b86c4c__cc66c6b00e999332d2a094e6c639d86f845be71938270d565a0d1a4b55b6aa85,INTERNATIONAL_COOPERATION,,International Cooperation,155,180,"Federal Republic of Somalia, Ministry of Planning and International Cooperation (2016) ""National",1.0,explorer
CCLW.GST.212.212,85d81d972831ab19a575da2c3f31ecd0__20387517c12401d8ce37f5be23ffd1cf759c707da231a3f5efadc5e27ba1fde2,INTERNATIONAL_COOPERATION,,international cooperation,525,550,"The table below summarizes technical, capacity building and financial support needs in some areas of interest for further international cooperation, without prejudice to other areas that may be identified further.",1.0,explorer
CCLW.GST.212.212,b0eb3cef16c738dd1e7eaf156b8a7e32__cd836b0932c462d6eff58cd93fb58ad0a1e2a968a13dc0149142a1ab754a9bee,INTERNATIONAL_COOPERATION,,international cooperation,378,403,The technical annexes also relied on financial resources from international cooperation projects (PoMuC - Policies on Climate Change and the GEF's Pilot Project on REDD+ Results-Based Payments).,1.0,explorer
CCLW.GST.165.165,e903ef230642a7c76c539d5b57195e71__b4afd9ab00497e88f0efa064e761461f9e2c0767449131bac478d91178843b8a,INTERNATIONAL_COOPERATION,,International Cooperation,454,479,"Said inventory has data captured through studies and characterizations, records and reports, coming from the municipalities, the Ministry of Environment and Natural Resources, the National Statistics Office, the Ministry of Industry and Commerce, the Central Bank, Drinking Water and Sewerage institutions, Town Halls and International Cooperation projects.",1.0,explorer
CCLW.GST.395.395,2445741f7fe2e214fd1c3cf34e9aea3c__861dcf774eb4dc4132705250a8ba0414ded96cac7eda99f3a709ed02901b9430,INTERNATIONAL_COOPERATION,,international cooperation,22,47,"The implementation of international cooperation measures in science and research belongs to the tasks of the OeAD-GmbH³3, which is a publicly owned entity.",1.0,explorer
CCLW.GST.659.659,8552acf2baa7afc5a66f169d98a4e168__d19776c689c3f3790fc4332b03dc2cbf797cb11ebac2c2dd7c70a25b85e66686,INTERNATIONAL_COOPERATION,,International Cooperation,61,86,"CCDA is also grateful for the Technical Assistance the Japan International Cooperation Agency
(JICA) provided in finalizing the GHG emissions estimations and in the final review and editions
on the overall document.",1.0,explorer
CCLW.GST.659.659,5915055d0e7260928e37c50ef211bd70__570d347d0eaeef0f577c6cb19d0247768e6e1d7c44a39e6c876e8a7e81486ccf,INTERNATIONAL_COOPERATION,,International Cooperation,6,31,Japan International Cooperation Agency; United Nations Development Programme; United Nations Environment Programme; UN Food and Agriculture Organization;,1.0,explorer
CCLW.GST.549.549,c29e2a45cc2627d4e3f0aee7c6bb3af3__4843f38831a60bb25020dc1dea6f0a8a9fc3ef61e01de5dbd51ccdd6b3abc72c,INTERNATIONAL_COOPERATION,,international cooperation,23,48,also mobilized through international cooperation.,1.0,explorer
CCLW.GST.171.171,11c956a0b69e52a604aa9c9e263c2209__b0ed22631078f5dcdadcdc8cf3700103e26dc04527145bd7691bd528b25f14ca,INTERNATIONAL_COOPERATION,,international cooperation,102,127,"3. Cross-convention event(s) with the aim to explore climate actions and support as well as enhancing international cooperation for climate action [in a way which builds on, and does not compromise other international environmental and development commitments]",1.0,explorer
CCLW.GST.171.171,d5c46994bbf510ad370c601af4d62538__9b2904f91de6bf794117704279ad4735050874ab4c1467a4e827452d93980ef8,INTERNATIONAL_COOPERATION,,international cooperation,82,107,"(3) Explore the linkages between climate actions and support as well as enhancing international cooperation for climate action [in a way which builds on, and does not compromise other international environmental and development commitments].",1.0,explorer
CCLW.GST.171.171,dbe5b207ca9af26c6e18d34d46f4fc9b__ad8345c18203c8ff218fb02606ea8fea2c7f25d7a0931075cdfcae6c738d4715,INTERNATIONAL_COOPERATION,,international cooperation,260,285,"14-3: The outcome of the global stocktake shall inform Parties in updating and enhancing, in a nationally determined manner, their actions and support in accordance with the relevant provisions of this Agreement, as well as in enhancing international cooperation for climate action.",1.0,explorer
CCLW.GST.171.171,2cc748914e74a7f375fc9eb48834532f__70061fd6c911e73d3abe9e4bd5199edc3de375dd8a43e17c5c9b69f21a122ea4,INTERNATIONAL_COOPERATION,,international cooperation,220,245,"This information is directly relevant to assessing climate actions that have been undertaken by Non-Party Stakeholders (question 29); and what additional information is needed to enhance these actions, including through international cooperation (question 30).",1.0,explorer
CCLW.GST.373.373,ca2f783f433dec2c409672120d1567d0__bcb597f87ee64c834a76cd063d45e5b053d4f3ca44e41fcf2d4007f645fa2aa2,INTERNATIONAL_COOPERATION,,international cooperation,570,595,"The GST is mandated to inform the preparation of future nationally determined contributions (NDCs) as well as to enhance international cooperation for climate action; thus, it is central to accelerating progress towards all objectives set out in the Paris Agreement.",1.0,explorer
CCLW.GST.373.373,ff7a594c55e7ee6493d43027f2ddb999__86d967b3754f2f75b586f1c2ebf16d0b1126605fdca5ec122a0805d3593a8145,INTERNATIONAL_COOPERATION,,international cooperation,346,371,"An important part of these measures, including the protection of internationally recognised labour rights, the promotion of social dialogue, collective bargaining and social participation, will benefit from international cooperation and support but does not necessarily require financial support.",1.0,explorer
CCLW.GST.166.166,2393777fa5a44f1e0efce316df116b31__f1bc405e1139e8329a257264dbea6b1e922d29361a0206bda308ffe64d2e9af2,INTERNATIONAL_COOPERATION,,international cooperation,634,659,"Serious efforts must be made to derive maximum benefit from international cooperation, whether bilateral or multilateral, in order to support the fight against climate change and enhance the effectiveness of the implementation of the Convention.",1.0,explorer
CCLW.GST.524.524,6a8cc0865c0b4cbc272e98a12a7f3800__cf74d3d54b96620ab0dbc290a7cdb5610f0ceff1ccc0344085a74dc0555c2703,INTERNATIONAL_COOPERATION,,international cooperation,73,98,"In order for CCS to play an effective role in climate change mitigation, international cooperation on developing and commercialising new technology is essential.",1.0,explorer
CCLW.GST.668.668,c79886d2a99dad4f0948147690449a1e__2740497a0772f44661eecb278156a18126a998714d2757b0eee42578dd92bd56,INTERNATIONAL_COOPERATION,,international cooperation,363,388,"To date, five NAMAS documents have been developed with the support of international cooperation.",1.0,explorer
CCLW.GST.501.501,b055aa5285c972aa0bacc733fb21df26__a086df079d452259f431c7aabeb852779f95364cd2e41052aad15c0fb753b397,INTERNATIONAL_COOPERATION,,international cooperation,25,50,"&quot;Promote the use of international cooperation to face the effects of climate change, pollution and environmental deterioration.",1.0,explorer
CCLW.GST.501.501,54330945d5ed2c0a04329ef2bd6d0a8d__6cbff5e5fa18f0d897949f81f36e63a0a57196158e1918397e5f2a89b4b82bc6,INTERNATIONAL_COOPERATION,,international cooperation,145,170,"The Nationally Determined Contribution (CND), fulfilling commitments of the Paris Agreement, under the UNFCCC, offers Cuba&#39;s contribution to international cooperation; based on the experience accumulated by the country, which has shared its results with other developing nations, especially small island states.",1.0,explorer
CCLW.GST.994.994,2cc748914e74a7f375fc9eb48834532f__70061fd6c911e73d3abe9e4bd5199edc3de375dd8a43e17c5c9b69f21a122ea4,INTERNATIONAL_COOPERATION,,international cooperation,220,245,"This information is directly relevant to assessing climate actions that have been undertaken by Non-Party Stakeholders (question 29); and what additional information is needed to enhance these actions, including through international cooperation (question 30).",1.0,explorer
CCLW.GST.895.895,1a004e72f31f577e95f8cc0200738035__b836af23a805561d2ed56904687e05ca8e6568a6cf60af715d64cc365b1c7e57,INTERNATIONAL_COOPERATION,,international cooperation,937,962,"Avenues to ensure that adequate climate adaptation and finance reaches those who need it the most, in line with the Paris Agreement, revolve around rethinking the means of implementation and support to improve access to climate finance in conflict and fragile situations, and finding ways to ensure that climate adaptation is adequately supported at the local level, notably through international cooperation.",1.0,explorer
CCLW.GST.209.209,32a8ec2e2b481d21ae1ce16803924a43__8a84ca97fd7a149712be583e543febe49f5d7cb22d7f222a7b42bff0dd40f63c,INTERNATIONAL_COOPERATION,,International Cooperation,13,38,: Center for International Cooperation in Agronomic Research for Development,1.0,explorer
CCLW.GST.209.209,42863016b83449fa2d6d6547828e107e__eb30c56020ea2a38eca2ef9c964ec06859f1a460f00dc22b31edde5872faf4db,INTERNATIONAL_COOPERATION,,international cooperation,19,44,"- multilateral and international cooperation: EU, AU, IFAD, UNDP, UNEP, UNESCO, AUF;",1.0,explorer
CCLW.GST.209.209,c7a389adcc212780f1617a95b7172735__f2a7e4f0f66cf1e437f44df487cf3f6dcf047d93bbff10dd6fdf184e31ead7af,INTERNATIONAL_COOPERATION,,international cooperation,0,25,international cooperation resulting from inter-State cooperation in the field of the fight against climate change.,1.0,explorer
CCLW.GST.657.657,a250bcfc9c655824505e90e601bf1c0b__46b9f2a1c71dd9da9f9e28695d6844dfc1707d2f23a978d90c180f65402cf7c4,INTERNATIONAL_COOPERATION,,International Cooperation,901,926,"In its BUR (table 34), Ghana also reported that it received non-financial support for 2014-2019, in the form of capacity-building and technical and technology assistance, from the Food and Agriculture Organization of the United Nations, the German Agency for International Cooperation, the Greenhouse Gas Inventory & Research Center of Korea, UNDP, UNEP and the UNFCCC and international aid agencies, to facilitate using the 2006 IPCC Guidelines in preparing its GHG inventory, constructing its NDC baseline, land-use mapping and preparing for effective implementation of the ETF.",1.0,explorer
CCLW.GST.962.962,aec0faa0753b4d3ba9f0a8fe3908f545__2f0e96f41eb49cd14d40db7e5c8e9ed6fc8bf54a867c25ef12d37fdaf561c16c,INTERNATIONAL_COOPERATION,,international cooperation,76,101,The finalizing of the Article 6 rulebook at COP26 provides a foundation for international cooperation involving carbon finance (using market mechanisms) and results-based climate finance.,1.0,explorer
CCLW.GST.962.962,d8f6771d13eee9ddb2dc7da8a290ef11__a037334c828110c73fc1f5925fd56bf15b5cd9125d6896fe891c4591bd05a8ec,INTERNATIONAL_COOPERATION,,international cooperation,87,112,"What is needed to enhance national level action and support, as well as
to enhance international cooperation for climate action, including in the
short term?",1.0,explorer
CCLW.GST.804.804,d4ad26b52c1be434a748763517f45fab__59e26bd693965fe03e38e1ac4a35c76e99b700aa8510d8202cb4bb7eb055af5b,INTERNATIONAL_COOPERATION,,International Cooperation,103,128,"Cooperation Strategy between the Republic of Moldava and Sweden fough the Swedish Agency for Deve
land International Cooperation (SIA) for 2014-2000-etp://www.i
for the Co-ladiation of Ahmative Pack (Noman and Domenic
Sold Wate) in the Lage Ciment (Moldova) (member of the LafugeHolcin Group) disken arace as wate
trgy operation (2015), chap://clatgead/Progunel_de_wallsare_a_skuri_iexpanskai_ara-
vil Impact As",1.0,explorer
CCLW.GST.821.821,6df2d6f935fb109613620f50717a2857__dbd624d97da5a20e838d9647156236c886cf2c75c1aa42bb2b81517553f1b11b,INTERNATIONAL_COOPERATION,,international cooperation,957,982,"The solution to this situation will notably involve measures that the Government will take and which relate in particular to the promotion of research and development, the adoption of technologies and their domestication in the national context; strengthening the functioning of certain organizations and institutions involved in dimatic change skills training and education international cooperation etc.",1.0,explorer
CCLW.GST.771.771,e4118a4fd52b3355a1d9dc7666797bc4__b74cb806e66441f02ca2940d39c286470ad043ecb32c375402a5430d3cfd933b,INTERNATIONAL_COOPERATION,,International Cooperation,18,43,German Agency for International Cooperation,1.0,explorer
CCLW.GST.771.771,58f0166fcc16ea1ea435308466bc9538__a3998dc717d051956c66e76b06deb1e671bb994f4a7aaf7b05f690694afd06af,INTERNATIONAL_COOPERATION,,international cooperation,533,558,When analyzing the financial resources coming from abroad -both via international cooperation and external financing- it is observed that they are considerably less than the amounts,1.0,explorer
CCLW.GST.771.771,3e9c64a6a9167130ec10923ecb7458ad__99e457140d3809d90109279bbb2d8607e8212b416cc1daa4ed0817e5a09a73a0,INTERNATIONAL_COOPERATION,,International Cooperation,19,44,German Society for International Cooperation (GIZ).,1.0,explorer
