md5sum,document_name,theme,type,author,author_type,date,language,link,pdf_link,validation_status,data_error_type,party,translation,version,status,source,topics
d147587673743c0976fc69c63a3584c2,Luxembourg. 2022 National Inventory Report (NIR),"GHG inventories, Mitigation",National inventory reports (NIR),Luxembourg,,2022-05-06T12:00:00Z,English,/documents/461887,https://unfccc.int/sites/default/files/resource/lux-2022-nir-06may22.zip,not validated,,Luxembourg,,,,UNFCCC Information Portal,"GHG inventories,Mitigation"
db08bce68f41ea58125bf371cf57842d,Ecuador. Biennial update report (BUR). BUR 1. National inventory report.,"Biennial update reports (BUR), Mitigation",National inventory reports (NIR),Ecuador. Biennial update report (BUR). BUR 1. National inventory report.,,,Spanish,/documents/180638,https://unfccc.int/sites/default/files/resource/ecu_NIR%20to%20BUR1_12jul17.zip,not validated,,Ecuador,,,,UNFCCC Information Portal,"Biennial update reports BUR,Mitigation"
0918cc76405ed5ba820a5c8d0cab3f5b,NIS to BUR3. Republic of Moldova.,"Biennial update reports (BUR), Mitigation",National inventory reports (NIR),Republic of Moldova,,2021-12-21T12:00:00Z,English,/documents/403589,https://unfccc.int/sites/default/files/resource/NIS_Report_2021_EN_211211-web.pdf,not validated,,Republic of Moldova,,,,UNFCCC Information Portal,"Biennial update reports BUR,Mitigation"
8b52477002e4a0312cbd590a7f0f50b9,Switzerland. Biennial report (BR). BR 4,Switzerland. Biennial report (BR). BR 4,Biennial reports (BR),Switzerland,,2019-12-18T12:00:00Z,English,/documents/204758,https://unfccc.int/sites/default/files/resource/CHE_BR4_2020_Projects%20and%20programmes%20to%20support%20climate%20action%20in%20developing%20country%20Parties.pdf,not validated,,Switzerland,,,,UNFCCC Information Portal,Emission reduction targets
37978a18791ff2be1bf121f8a964d13f,Italy. 2021 National Inventory Report (NIR),"GHG inventories, Mitigation",National inventory reports (NIR),Italy,,2021-04-12T12:00:00Z,English,/documents/271491,https://unfccc.int/sites/default/files/resource/ita-2021-nir-12apr21.zip,not validated,,Italy,,,,UNFCCC Information Portal,"GHG inventories,Mitigation"
c1b4bbc94d3b37099c040032bc15ff0f,The Glasgow Financial Alliance for Net Zero: Our progress and plan towards a net-zero global economy,Climate finance,Submissions to the Global Stocktake,High-Level Champions for Climate Action,,2022-03-31T12:00:00Z,English,/documents/461542,https://unfccc.int/sites/default/files/resource/GFANZ-Progress-Report.pdf,not validated,,,,,,UNFCCC Information Portal,Climate finance
8f74dc167bce2bc32b49a6909b4819fd,Nationally determined contributions under the Paris Agreement. Synthesis report by the secretariat,"Nationally determined contributions (NDCs), Ambition and collective progress, Adaptation, Mitigation",Synthesis reports,UNFCCC. Conference of the Parties serving as the meeting of the Parties to the Paris Agreement (CMA),,2021-02-26T12:00:00Z,Chinese,/documents/268571,https://unfccc.int/sites/default/files/resource/cma2021_02C.pdf,not validated,,,,,,UNFCCC Information Portal,"Nationally determined contributions NDCs,Ambition and collective progress,Adaptation,Mitigation"
523239714d7dcef77499e8bc57f0e352,China's submission to the global stocktake,"Loss and damage, Adaptation, Capacity-building, Climate finance, Equity, Means of implementation, Response measures, Technology, Science and research, Mitigation",Submissions to the Global Stocktake,China,,2022-12-05T12:00:00Z,English,/documents/624549,https://unfccc.int/sites/default/files/resource/202212011137---China_s%20Submission%20on%20the%20Global%20Stocktake.pdf,not validated,,,,,,UNFCCC Information Portal,"Loss and damage,Adaptation,Capacitybuilding,Climate finance,Equity,Means of implementation,Response measures,Technology,Science and research,Mitigation"
d6e3fac1a0a9efef3526d9c0e8392350,Australia. 2022 National Inventory Report (NIR),"GHG inventories, Mitigation",National inventory reports (NIR),Australia,,2022-05-27T12:00:00Z,English,/documents/478957,https://unfccc.int/sites/default/files/resource/aus-2022-nir-27may22.zip,not validated,,Australia,,,,UNFCCC Information Portal,"GHG inventories,Mitigation"
57129d1aecb5e99ee16082265a62c764,Republic of Korea. National communication (NC). NC4.,"Policies and measures, Mitigation",National communications (NC),Republic of Korea,,2019-12-03T12:00:00Z,English,/documents/202573,https://unfccc.int/sites/default/files/resource/Fourth%20National%20Communication%20of%20the%20ROK%20under%20the%20UNFCCC.pdf,not validated,,Republic of Korea,,,,UNFCCC Information Portal,"Policies and measures,Mitigation"
587fce19705990af35f2e8c6dad92bdb,Suriname. Biennial update report (BUR).  BUR 1.,Mitigation actions and commitments,Biennial update reports (BUR),Suriname,,2022-11-05T12:00:00Z,English,/documents/622910,https://unfccc.int/sites/default/files/resource/Suriname%20BUR1%20Final%20.pdf,not validated,,Suriname,,,,UNFCCC Information Portal,Mitigation actions and commitments
b50fb973a5e645c34ba8bc05e904f29b,Republic of Korea. Biennial update report (BUR). BUR4.,"Measurement, reporting and verification (MRV), Mitigation",Republic of Korea. Biennial update report (BUR). BUR4.,Republic of Korea,,2021-12-30T12:00:00Z,English,/documents/418616,https://unfccc.int/sites/default/files/resource/211230_4th%20BUR_ROK_220308_editorial%20change.pdf,not validated,,Republic of Korea,,,,UNFCCC Information Portal,"Measurement reporting and verification MRV,Mitigation"
ac479b3739aeac91abee710e77f08185,NDC aspects project: Ensuring an Effective Global Stocktake with a Sectoral Perspective,"Global stocktake, Loss and damage, Adaptation, Equity, Climate finance, Capacity-building, Science and research, Technology, Response measures, Means of implementation, Mitigation",NDC aspects project: Ensuring an Effective Global Stocktake with a Sectoral Perspective,NDC ASPECTS,,2022-08-10T12:00:00Z,English,/documents/579947,https://unfccc.int/sites/default/files/resource/202208101044---20220805_NDC%20ASPECTS_GST%20submission.pdf,not validated,,,,,,UNFCCC Information Portal,"Global stocktake,Loss and damage,Adaptation,Equity,Climate finance,Capacitybuilding,Science and research,Technology,Response measures,Means of implementation,Mitigation"
440eb86e4e6e9eebc38a1ed76d95215c,Transitions in the land sector and environmental integrity: safe and just pathways towards climate neutrality: Submission to Global Stocktake,"Global stocktake, Adaptation, Mitigation, Science and research",Submissions to the Global Stocktake,Transitions in the land sector and environmental integrity: safe and just pathways towards climate neutrality: Submission to Global Stocktake,,2022-04-13T12:00:00Z,English,/documents/461856,https://unfccc.int/sites/default/files/resource/202202101758---Land%20Sector%20Carbon%20Neutrality%20and%20Environmental%20Integrity.pdf,not validated,,,,,,UNFCCC Information Portal,"Global stocktake,Adaptation,Mitigation,Science and research"
be1cb10d38a7f471c85487ccc1565a43,Sri Lanka. National Communication (NC). NC 3.,Sri Lanka. National Communication (NC). NC 3.,National communications (NC),Sri Lanka,,2022-12-01T12:00:00Z,English,/documents/624533,https://unfccc.int/sites/default/files/resource/Third%20National%20Communication%20of%20Sri%20Lanka.pdf,not validated,,Sri Lanka,,,,UNFCCC Information Portal,"National communications NC,Mitigation"
8431ffd8b5d150fe0b8a8ce572ba3bbc,Papua New Guinea. Biennial update report (BUR). BUR2. National Inventory Report,"Measurement, reporting and verification (MRV), Mitigation",Biennial update reports (BUR),Papua New Guinea,,2022-05-30T12:00:00Z,English,/documents/490300,https://unfccc.int/sites/default/files/resource/PNG_NIR_final.pdf,not validated,,Papua New Guinea,,,,UNFCCC Information Portal,"Measurement reporting and verification MRV,Mitigation"
01f66ee461e30e8b1b70227f49ceb9ea,ICC Submission to First Global Stocktake,"Global stocktake, Adaptation, Mitigation, Means of implementation, Capacity-building, Science and research, Climate finance, Technology, Equity, Response measures, Loss and damage",Submissions to the Global Stocktake,International Chamber of Commerce (ICC),,2022-08-08T12:00:00Z,English,/documents/574256,https://unfccc.int/sites/default/files/resource/202208062347---2022_ICC%20Comment%20of%20First%20Global%20Stocktake_final.pdf,not validated,,,,,,UNFCCC Information Portal,"Global stocktake,Adaptation,Mitigation,Means of implementation,Capacitybuilding,Science and research,Climate finance,Technology,Equity,Response measures,Loss and damage"
cd4c1688e024e7f32d79bea23b61efd9,North Macedonia. Biennial update report (BUR). BUR 3. National inventory report.,"Biennial update reports (BUR), Mitigation",National inventory reports (NIR),North Macedonia,,2021-06-03T12:00:00Z,English,/documents/278545,https://unfccc.int/sites/default/files/resource/1%20TBUR_NIR_EN_MANU_Final_08.2020.pdf,not validated,,North Macedonia,,,,UNFCCC Information Portal,"Biennial update reports BUR,Mitigation"
4675cecf20c9bf61574f0d40fe873a61,Cook Islands. National communication (NC). NC 3.,"Policies and measures, National communications (NC), Mitigation",National communications (NC),Cook Islands,,2020-08-07T12:00:00Z,English,/documents/231917,https://unfccc.int/sites/default/files/resource/TNC%20FINAL.%20online.pdf,not validated,,Cook Islands,,,,UNFCCC Information Portal,"Policies and measures,National communications NC,Mitigation"
e4520d254dc574f1e524100919de28f1,Chad. National Communication (NC). NC 2.,"National communications (NC), Mitigation",National communications (NC),Chad,,,French,/documents/71490,https://unfccc.int/sites/default/files/resource/tcdnc2.pdf,not validated,,Chad,,,,UNFCCC Information Portal,"National communications NC,Mitigation"
e9f77039ac7bf92305512d278a3fd178,Republic Of Moldova. Biennial update report (BUR). BUR 2.,"Biennial update reports (BUR), Mitigation",Biennial update reports (BUR),Republic of Moldova,,2018-12-27T12:00:00Z,English,/documents/192185,https://unfccc.int/sites/default/files/resource/Moldova_BUR2_EN_web_19.04.2019.pdf,not validated,,Republic of Moldova,,,,UNFCCC Information Portal,"Biennial update reports BUR,Mitigation"
f5802fb4ac96b7d8cc35a097c13b7c34,Morocco. National communication (NC). NC 4.,Morocco. National communication (NC). NC 4.,National communications (NC),Morocco,,2021-12-30T12:00:00Z,French,/documents/419678,https://unfccc.int/sites/default/files/resource/Quatri%C3%A8me%20Communication%20Nationale_MOR.pdf,not validated,,Morocco,,,,UNFCCC Information Portal,"Policies and measures,National communications NC,Mitigation"
96170e336cf011a7536b081e89d5fd01,Angola. National Communication (NC). NC 1.,"National communications (NC), Mitigation",National communications (NC),Angola,,,English,/documents/67469,https://unfccc.int/sites/default/files/resource/agonc1.pdf,not validated,,Angola,,,,UNFCCC Information Portal,"National communications NC,Mitigation"
5dbbffa666d20d97d50afe0ec79128e0,Submission by the United States on the First Global Stocktake,"Equity, Global stocktake, Loss and damage, Capacity-building, Climate finance, Adaptation, Means of implementation, Response measures, Mitigation, Science and research, Technology",Submissions to the Global Stocktake,United States of America,,2022-06-09T12:00:00Z,English,/documents/510077,https://unfccc.int/sites/default/files/resource/202206081633---United%20States%20GST%20Submission_final.pdf,not validated,,,,,,UNFCCC Information Portal,"Equity,Global stocktake,Loss and damage,Capacitybuilding,Climate finance,Adaptation,Means of implementation,Response measures,Mitigation,Science and research,Technology"
9dd2e7be8fe577dcaae6c5063bafef48,Finland. National Communication (NC). NC 7.,"Policies and measures, National communications (NC), Adaptation, Mitigation",National communications (NC),Finland,,2017-12-13T12:00:00Z,English,/documents/198252,https://unfccc.int/sites/default/files/resource/952371_Finland-NC7-1-fi_nc7_final.pdf,not validated,,Finland,,,,UNFCCC Information Portal,"Policies and measures,National communications NC,Adaptation,Mitigation"
cf91070f94601317a0c1f9c39f80d712,Costa Rica. National Communication (NC). NC 3.,"National communications (NC), Mitigation",National communications (NC),Costa Rica,,,Spanish,/documents/104872,https://unfccc.int/sites/default/files/resource/crinc3.pdf,not validated,,Costa Rica,,,,UNFCCC Information Portal,"National communications NC,Mitigation"
c13182c3d9ef5e16b57a2db89af77074,Turkey. 2021 National Inventory Report (NIR),"GHG inventories, Mitigation",National inventory reports (NIR),Türkiye,,2021-04-13T12:00:00Z,English,/documents/271544,https://unfccc.int/sites/default/files/resource/tur-2021-nir-13apr21.zip,not validated,,Türkiye,,,,UNFCCC Information Portal,"GHG inventories,Mitigation"
e33882b8431a9aadb330e686b60efdb3,Eritrea. National communication (NC). NC 3.,"Policies and measures, National communications (NC), Mitigation",National communications (NC),Eritrea,,2021-12-30T12:00:00Z,English,/documents/417648,https://unfccc.int/sites/default/files/resource/Eritrea%20NC3.pdf,not validated,,Eritrea,,,,UNFCCC Information Portal,"Policies and measures,National communications NC,Mitigation"
f14595062036af411019203ea6f2b366,Record of  the facilitative sharing of views at the fifty-second to fifty-fifth session of the Subsidiary Body for Implementation: Uruguay (FSVR3),"Mitigation, National reports, reviews and analysis, Transparency framework",Facilitative sharing of views reports (FSVR),UNFCCC. Secretariat,,2022-01-21T12:00:00Z,English only,/documents/430523,https://unfccc.int/sites/default/files/resource/FSVR3_URU.pdf,not validated,,,,,,UNFCCC Information Portal,"Mitigation,National reports reviews and analysis,Transparency framework"
aaff09f3d6ba4c1a628d6417200ef58b,Designing a meaningful global stocktake. Center for Climate and Energy Solutions (C2ES),"Equity, Loss and damage, Response measures, Climate finance, Means of implementation, Capacity-building, Technology, Science and research",Submissions to the Global Stocktake,Designing a meaningful global stocktake. Center for Climate and Energy Solutions (C2ES),,2022-04-01T12:00:00Z,English,/documents/461593,https://unfccc.int/sites/default/files/resource/202202281810---C2ES_EDF%20Mitigation%20Landscape%20Analysis%20Themes%20and%20Trends.pdf,not validated,,,,,,UNFCCC Information Portal,"Equity,Loss and damage,Response measures,Climate finance,Means of implementation,Capacitybuilding,Technology,Science and research"
1fa6897b74c5e62e3878871d3933ab6b,Initial submission by the UN climate change high-level champions to the first global stocktake under the Paris agreement,"Climate finance, Response measures, Means of implementation, Adaptation, Capacity-building, Mitigation, Global stocktake",Submissions to the Global Stocktake,High-Level Champions for Climate Action,,2022-03-31T12:00:00Z,English,/documents/461546,https://unfccc.int/sites/default/files/resource/220228%20HLC%20Submission%20to%20First%20GST%20-%20Submitted.docx.pdf,not validated,,,,,,UNFCCC Information Portal,"Climate finance,Response measures,Means of implementation,Adaptation,Capacitybuilding,Mitigation,Global stocktake"
30af12a18593ae28ba09e76d8622e7b1,The global stocktake: an opportunity for ambition. Climate Finance Landscape Analysis: Themes and Trends. Center for Climate and Energy Solutions,"Global stocktake, Climate finance",Submissions to the Global Stocktake,Center for Climate and Energy Solutions (C2ES),,2022-04-01T12:00:00Z,English,/documents/461592,https://unfccc.int/sites/default/files/resource/202202281810---C2ES_EDF%20Climate%20Finance%20Landscape%20Analysis%20Themes%20and%20Trends.pdf,not validated,,,,,,UNFCCC Information Portal,"Global stocktake,Climate finance"
ac9ad3d3f276d3b02d77d219e6dbf801,Central African Republic. National Communication (NC). NC 2.,"National communications (NC), Mitigation",National communications (NC),Central African Republic,,,French,/documents/71142,https://unfccc.int/sites/default/files/resource/cafnc2.pdf,not validated,,Central African Republic,,,,UNFCCC Information Portal,"National communications NC,Mitigation"
d6c614d4ca70544d2d53e28ac53e9856,Technical analysis of the first biennial update report of Lesotho submitted on 9 November 2021. Summary report by the team of technical experts,"Biennial update reports (BUR), National communications (NC), International consultations and analysis (ICA), Mitigation, Means of implementation",Technical analysis summary report (TASR),UNFCCC. Secretariat,,2023-01-11T12:00:00Z,English,/documents/624828,https://unfccc.int/sites/default/files/resource/tasr1_2022_LSO.pdf,not validated,,Lesotho,,,,UNFCCC Information Portal,"Biennial update reports BUR,National communications NC,International consultations and analysis ICA,Mitigation,Means of implementation"
51d892dee83da819172208413dd4b1eb,Technical analysis of the first biennial update report of Panama submitted on 14 December 2018. Summary report by the team of technical experts,"GHG inventories, Emission reduction targets, Means of implementation",Technical analysis summary report (TASR),Technical analysis of the first biennial update report of Panama submitted on 14 December 2018. Summary report by the team of technical experts,,2019-12-11T12:00:00Z,English only,/documents/204439,https://unfccc.int/sites/default/files/resource/tasr2019_PAN.pdf,not validated,,Panama,,,,UNFCCC Information Portal,"GHG inventories,Emission reduction targets,Means of implementation"
f7cc667c1c181ed4b7cce08c38afc136,Armenia. Biennial update report (BUR). BUR 3.,Mitigation actions and commitments,Biennial update reports (BUR),Armenia,,2021-05-17T12:00:00Z,English,/documents/274257,https://unfccc.int/sites/default/files/resource/BUR3_Armenia.pdf,not validated,,Armenia,,,,UNFCCC Information Portal,Mitigation actions and commitments
9a7e38b7f960154ae77aa83782272354,New Zealand. National Communication (NC). NC 8.,"Policies and measures, National communications (NC), Adaptation, Mitigation",New Zealand. National Communication (NC). NC 8.,New Zealand,,2022-12-22T12:00:00Z,English,/documents/624714,https://unfccc.int/sites/default/files/resource/New-Zealands-Eighth-National-Communication.pdf,not validated,,New Zealand,,,,UNFCCC Information Portal,"Policies and measures,National communications NC,Adaptation,Mitigation"
e2c2beba41b3399d74818a59a1eca367,Burundi. National communication (NC). NC 3.,"Policies and measures, Mitigation",National communications (NC),Burundi,,2019-10-31T12:00:00Z,French,/documents/201148,https://unfccc.int/sites/default/files/resource/Burundi%20TNC_FINAL.pdf,not validated,,Burundi,,,,UNFCCC Information Portal,"Policies and measures,Mitigation"
dc99c79660bdd03177006b6c2993201e,Benin. National communication (NC). NC 3.,"Policies and measures, National communications (NC), Mitigation",National communications (NC),Benin,,2019-10-28T12:00:00Z,French,/documents/201032,https://unfccc.int/sites/default/files/resource/BENIN_TCN_2019.pdf,not validated,,Benin,,,,UNFCCC Information Portal,"Policies and measures,National communications NC,Mitigation"
1d645afd1ab33faea74a694395e5f751,Panama. National Communication (NC). NC 3.,"National communications (NC), Mitigation",Panama. National Communication (NC). NC 3.,Panama,,2018-10-19T12:00:00Z,Spanish,/documents/183505,https://unfccc.int/sites/default/files/resource/Tercera%20Comunicacion%20Nacional%20Panama.pdf,not validated,,Panama,,,,UNFCCC Information Portal,"National communications NC,Mitigation"
6d5101861f85ecc44f1f20acb69a80c9,Cambodia. Biennial update report (BUR). BUR1. National inventory report,"Biennial update reports (BUR), Mitigation",National inventory reports (NIR),Cambodia,,2020-11-10T12:00:00Z,English,/documents/266294,https://unfccc.int/sites/default/files/resource/National_GHG_Inventory_Cambodia.pdf,not validated,,Cambodia,,,,UNFCCC Information Portal,"Biennial update reports BUR,Mitigation"
8330cbc6f7ccb63d23d9b7ec6a15eac0,OECD Submission to the First Global Stocktake,"Global stocktake, Climate finance",Submissions to the Global Stocktake,Organisation for Economic Co-operation and Development (OECD),,2022-04-13T12:00:00Z,English,/documents/461846,https://unfccc.int/sites/default/files/resource/202203071516---2022.02-OECD-Inputs-to-the-Global-Stocktake.pdf,not validated,,,,,,UNFCCC Information Portal,"Global stocktake,Climate finance"
9c0d5962e7c247b867a29d1a0039dd6c,Submission to UNFCCC First Global Stocktake from The Global Carbon Project within the Future Earth research initiative,"Global stocktake, Science and research",Submissions to the Global Stocktake,"Global Carbon Project (GCP), Future Earth",,2022-04-13T12:00:00Z,English,/documents/461833,https://unfccc.int/sites/default/files/resource/202203011247---Global%20Carbon%20Project_submission_Feb2022.pdf,not validated,,,,,,UNFCCC Information Portal,"Global stocktake,Science and research"
a65034333a6474f947f639c9417ef3eb,Proposed responses of the International Platform on Adaptation Metrics (IPAM) to the Guiding questions by the SB Chairs for the Technical Assessment component of the first Global Stocktake,"Global stocktake, Adaptation",Submissions to the Global Stocktake,International Platform on Adaptation Metrics (IPAM),,2022-08-10T12:00:00Z,English,/documents/580110,https://unfccc.int/sites/default/files/resource/202208081022---IPAM%20submission%20to%20first%20Global%20Stocktake.pdf,not validated,,,,,,UNFCCC Information Portal,"Global stocktake,Adaptation"
dfde1e01e6e0ecb07e476f353f245d59,Romania. National Communication (NC). NC 7.,"Policies and measures, National communications (NC), Adaptation, Mitigation",National communications (NC),Romania,,2017-12-27T12:00:00Z,English,/documents/198286,https://unfccc.int/sites/default/files/resource/0587134_Romania-NC7-1-Annex%203.1_NC7.pdf,not validated,,Romania,,,,UNFCCC Information Portal,"Policies and measures,National communications NC,Adaptation,Mitigation"
a67e5497ebce0d2a0b292ed9bd982223,Togo. Biennial update report (BUR). BUR 2. National inventory report.,"Biennial update reports (BUR), Mitigation",National inventory reports (NIR),Togo,,2021-12-13T12:00:00Z,French,/documents/397887,https://unfccc.int/sites/default/files/resource/NIR_2021_TOGO.pdf,not validated,,Togo,,,,UNFCCC Information Portal,"Biennial update reports BUR,Mitigation"
9d97d35d376a8f6fbda39a6a09866928,Equatorial Guinea. National communication (NC). NC1.,"Policies and measures, National communications (NC), Mitigation",National communications (NC),Equatorial Guinea,,,English,/documents/201018,https://unfccc.int/sites/default/files/resource/INC%20of%20Equatorial%20Guinea_English%20version.pdf,not validated,,Equatorial Guinea,,,,UNFCCC Information Portal,"Policies and measures,National communications NC,Mitigation"
564ecee05c11483bc47bd45ca34a4edb,Climate Action Pathway: Transport. Action Table,"Transport, Adaptation, Means of implementation, Mitigation, Science and research, Technology",Publications,Marrakech Partnership,,2021-06-29T12:00:00Z,English,/documents/279313,https://unfccc.int/sites/default/files/resource/Transport_ActionTable_2.1.pdf,not validated,,,,,,UNFCCC Information Portal,"Transport,Adaptation,Means of implementation,Mitigation,Science and research,Technology"
fbabca288a71054821a87ac930f4c825,Facilitative sharing of views record - BUR2 Paraguay,"Transparency framework, Means of implementation, Mitigation",Facilitative sharing of views reports (FSVR),UNFCCC Authors,,2021-04-09T12:00:00Z,English,/documents/271432,https://unfccc.int/sites/default/files/resource/FSVR2_PRY.pdf,not validated,,,,,,UNFCCC Information Portal,"Transparency framework,Means of implementation,Mitigation"
a1c114f66f17c0c168eea4210dff7213,Technical analysis of the third biennial update report of Singapore submitted on 27 December 2018. Summary report by the team of technical experts,"GHG inventories, Emission reduction targets, Means of implementation",Technical analysis summary report (TASR),Technical analysis of the third biennial update report of Singapore submitted on 27 December 2018. Summary report by the team of technical experts,,2020-01-16T12:00:00Z,English,/documents/209421,https://unfccc.int/sites/default/files/resource/tasr2019_SGP.pdf,not validated,,Singapore,,,,UNFCCC Information Portal,"GHG inventories,Emission reduction targets,Means of implementation"
617943c71f5de963d2cd6c73c097c111,International Cryosphere Climate Initiative (ICCI): Submission to the First Global Stocktake,"Mitigation, Global stocktake",Submissions to the Global Stocktake,International Cryosphere Climate Initiative (ICCI),,2022-05-02T12:00:00Z,English,/documents/470444,https://unfccc.int/sites/default/files/resource/First%20Submission%20ICCI.pdf,not validated,,,,,,UNFCCC Information Portal,"Mitigation,Global stocktake"
07b03a7e6065e1d62372f474dfc41a79,Morocco. National Communication (NC). NC 3.,"National communications (NC), Mitigation",National communications (NC),Morocco,,,French,/documents/128109,https://unfccc.int/sites/default/files/resource/Marnc3.pdf,not validated,,Morocco,,,,UNFCCC Information Portal,"National communications NC,Mitigation"
3bd20e5718f8ca6b4d22b8e79d10f825,Nationally determined contributions under the Paris Agreement. Synthesis report by the secretariat,Nationally determined contributions (NDCs),Nationally determined contributions under the Paris Agreement. Synthesis report by the secretariat,UNFCCC. Secretariat,,2021-09-17T12:00:00Z,Chinese,/documents/306848,https://unfccc.int/sites/default/files/resource/cma2021_08C.pdf,not validated,,,,,,UNFCCC Information Portal,Nationally determined contributions NDCs
